DOI,Year,Title,Journal,Reason
10.1016/j.energy.2023.129592,2024,Study on energy-saving potential of lowering the emissivity of unheated surfaces for floor radiant heating,Energy,Eliminated – unclear/other
10.1016/j.jclepro.2024.140967,2024,"Climate change's effects on the amount of energy used for cooling in hot, humid office buildings and the solutions",Journal of Cleaner Production,Eliminated – Planning/Top-down
10.1016/j.enbuild.2023.113757,2024,Towards a blockchain and machine learning-based framework for decentralised energy management,Energy and Buildings,KEEP – operational EE/control
10.1016/j.jobe.2024.111351,2024,Enhancing the accuracy of climate zoning for buildings through precise climate variables selection and novel misclassification index,Journal of Building Engineering,Eliminated – Monitoring/Forecasting only
10.1016/j.buildenv.2024.111186,2024,Assessing built microclimate with building group frontal projection maps: A sun-path-dependent deep transfer learning neural network approach,Building and Environment,Eliminated – unclear/other
10.1016/j.enbuild.2024.114955,2024,Temperature adaptive passive daytime radiative cooling: The impact of their essential properties on energy performance of different building types,Energy and Buildings,Eliminated – Materials/Envelope
10.1016/j.buildenv.2024.111234,2024,"What is NExT? A new conceptual model for comfort, satisfaction, health, and well-being in buildings",Building and Environment,Eliminated – unclear/other
10.1016/j.jobe.2024.108526,2024,Artificial intelligent based techno-economic-exergetic optimization of a thermoelectric enhanced building integrated photovoltaic thermal system,Journal of Building Engineering,Eliminated – Renewable-only
10.1016/j.enbuild.2024.114036,2024,An energy-efficient exhaust hood for industrial buildings with strong thermal buoyancy,Energy and Buildings,Eliminated – Other/Industry
10.1016/j.apenergy.2024.123545,2024,An adaptive privacy protection framework for user energy data using dictionary learning and watermarking techniques,Applied Energy,Eliminated – unclear/other
10.1016/j.ijhydene.2024.07.419,2024,Research on the flow characteristics of injecting hydrogen into natural gas pipelines and its impact on energy metering,International Journal of Hydrogen Energy,Eliminated – Renewable-only
10.1016/j.enbuild.2024.113957,2024,Analysis of sensor offset characteristics in building energy systems based on redundant sensors: A case study on variable air volume system,Energy and Buildings,Eliminated – unclear/other
10.1016/j.jclepro.2023.140086,2024,Flexibility potential quantification and regulation measure comparison for the building air-conditioning system,Journal of Cleaner Production,KEEP – operational EE/control
10.1016/j.energy.2024.130619,2024,Reduction of electricity consumption in an AHU using mathematical modelling for controller tuning,Energy,KEEP – operational EE/control
10.1016/j.apenergy.2023.122238,2024,Novel building energy performance-based climate zoning enhanced with spatial constraint,Applied Energy,Eliminated – Planning/Top-down
10.1016/j.scs.2024.105654,2024,Geospatial modelling of seasonal water and electricity consumption in Doha's residential buildings using multiscale geographically weighted regression (MGWR) and Bootstrap analysis,Sustainable Cities and Society,Eliminated – unclear/other
10.1016/j.enbuild.2024.114819,2024,Quantifying the potential of load flexibility for building HVAC system using model predictive control strategy,Energy and Buildings,KEEP – operational EE/control
10.1016/j.jobe.2023.108341,2024,Investigating adaptive sampling strategies for optimal building energy performance using artificial neural networks and kriging surrogate models,Journal of Building Engineering,Eliminated – unclear/other
10.1016/j.applthermaleng.2024.123245,2024,A two-stage fault diagnosis strategy for air handling units via a backpropagation multidimensional Taylor network fitter and a novel statistical process control,Applied Thermal Engineering,KEEP – operational EE/control
10.1016/j.enbuild.2024.114754,2024,Optimizing energy consumption in smart buildings: A model for efficient energy management and renewable integration,Energy and Buildings,KEEP – operational EE/control
10.1016/j.enbuild.2024.114249,2024,Building consumption anomaly detection: A comparative study of two probabilistic approaches,Energy and Buildings,Eliminated – unclear/other
10.1016/j.jobe.2024.110447,2024,Implications of latent and sensible building energy loads using natural ventilation,Journal of Building Engineering,Eliminated – Ventilation/IAQ only
10.1016/j.jobe.2024.109237,2024,A simplified dynamic tool for building heating and cooling energy requirements estimation on a daily time scale,Journal of Building Engineering,Eliminated – Monitoring/Forecasting only
10.1016/j.buildenv.2024.111161,2024,Study on the infection control performance under interactive cascade ventilation: A focus on a conference room environment,Building and Environment,KEEP – operational EE/control
10.1016/j.enbuild.2024.114568,2024,Comparison of EnergyPlus inside surfaces convective heat transfer coefficients algorithms for energy modelling of high-density controlled environment agriculture,Energy and Buildings,KEEP – operational EE/control
10.1016/j.buildenv.2023.111023,2024,Impact of building porosity on exterior convective heat transfer coefficients: An experimental and computational parametric study,Building and Environment,Eliminated – unclear/other
10.1016/j.jclepro.2024.142268,2024,Capabilities and social practices: A combined conceptual framework for domestic energy use,Journal of Cleaner Production,Eliminated – unclear/other
10.1016/j.enbuild.2024.114913,2024,A convolutional neural network to control sound level for air conditioning units in four different classroom conditions,Energy and Buildings,KEEP – operational EE/control
10.1016/j.jobe.2024.111143,2024,An interactive clustering method via metric learning for analyzing energy consumption patterns,Journal of Building Engineering,Eliminated – Monitoring/Forecasting only
10.1016/j.enbenv.2022.10.006,2024,Feasibility of condensate water recycle of split air handling unit in Chinese University buildings,Energy and Built Environment,Eliminated – unclear/other
10.1016/j.jobe.2024.108608,2024,Application of a Calibrated Building Energy Model for the optimal sizing of a photovoltaic plant: An approach from self-consumption,Journal of Building Engineering,Eliminated – Renewable-only
10.1016/j.buildenv.2024.112018,2024,Usability of personalized thermal control systems by people with intellectual disabilities in energy poverty,Building and Environment,KEEP – operational EE/control
10.1016/j.apenergy.2024.124262,2024,New robust multi-criteria decision-making framework for thermal insulation of buildings under conflicting stakeholder interests,Applied Energy,Eliminated – Materials/Envelope
10.1016/j.apenergy.2023.122360,2024,Building for tomorrow: Analyzing ideal thermal transmittances in the face of climate change in Brazil,Applied Energy,Eliminated – Planning/Top-down
10.1016/j.scs.2024.105312,2024,Seasonal anthropogenic heat fluxes over 200 cities in China: An investigation of driving factors with three-dimensional building forms,Sustainable Cities and Society,Eliminated – unclear/other
10.1016/j.enbuild.2024.114665,2024,Comparing mechanical ventilation control strategies for indoor air quality: Monitoring and simulation results of a school building in northern Italy,Energy and Buildings,KEEP – operational EE/control
10.1016/j.jclepro.2024.142522,2024,Unraveling the complexity: A taxonomy for characterizing and structuring smart energy services in the building sector,Journal of Cleaner Production,Eliminated – unclear/other
10.1016/j.enbuild.2024.114117,2024,Sensitivities of energy use reduction in subtropical high-rise office buildings: A Hong Kong case,Energy and Buildings,Eliminated – unclear/other
10.1016/j.jobe.2024.109248,2024,Multiple regional climate model projections to assess building thermal performance in Brazil: Understanding the uncertainty,Journal of Building Engineering,Eliminated – unclear/other
10.1016/j.enbuild.2024.114141,2024,Closing the energy flexibility gap: Enriching flexibility performance rating of buildings with monitored data,Energy and Buildings,KEEP – operational EE/control
10.1016/j.jobe.2024.110610,2024,An integrated model of the driving mechanism for the building energy performance gap,Journal of Building Engineering,Eliminated – unclear/other
10.1016/j.buildenv.2024.111387,2024,Dimensionless correlations of indoor thermal stratification in a non-enclosed large-space building under heating and cooling conditions,Building and Environment,Eliminated – unclear/other
10.1016/j.scs.2024.105298,2024,A novel building flexibility potential assessment method based on hybrid CNN-GRU-CALDA framework considering consumer psychology,Sustainable Cities and Society,KEEP – operational EE/control
10.1016/j.buildenv.2024.111875,2024,Evaluating human perception of building exteriors using street view imagery,Building and Environment,Eliminated – unclear/other
10.1016/j.ymssp.2023.110906,2024,Reduced-order model for RBDO of multiple TMDs on eccentric L-shaped buildings subjected to seismic excitations,Mechanical Systems and Signal Processing,Eliminated – unclear/other
10.1016/j.enbuild.2024.114439,2024,Three-tier integrated demand-supply energy management for optimized energy usage in institutional building,Energy and Buildings,KEEP – operational EE/control
10.1016/j.rser.2024.114745,2024,Consumers’ adoption characteristics of distributed energy resources and flexible loads behind the meter,Renewable and Sustainable Energy Reviews,Eliminated – unclear/other
10.1016/j.apenergy.2024.123348,2024,Fast-apply deep autoregressive recurrent proximal policy optimization for controlling hot water systems,Applied Energy,KEEP – operational EE/control
10.1016/j.apenergy.2024.123406,2024,Analysing the influence of growing conditions on both energy load and crop yield of a controlled environment agriculture space,Applied Energy,KEEP – operational EE/control
10.1016/j.enbuild.2024.114543,2024,Insights from hydronic heating systems in 259 commercial buildings,Energy and Buildings,Eliminated – unclear/other
10.1016/j.enbuild.2024.114359,2024,A study on price responsive energy flexibility of an office building under cooling dominated climatic conditions,Energy and Buildings,KEEP – operational EE/control
10.1016/j.applthermaleng.2024.123611,2024,Evaluating advanced HVAC control benefits in operational buildings using historic data — A case study,Applied Thermal Engineering,KEEP – operational EE/control
10.1016/j.buildenv.2024.111908,2024,Intermittent demand-controlled ventilation for energy flexibility and indoor air quality,Building and Environment,KEEP – operational EE/control
10.1016/j.renene.2024.120369,2024,Enhancing typical Meteorological Year generation for diverse energy systems: A hybrid Sandia-machine learning approach,Renewable Energy,Eliminated – unclear/other
10.1016/j.enbuild.2024.114584,2024,Comprehensive bottom-up methodology for generating high-resolution yearly building load profiles: A case study in temperate oceanic climate,Energy and Buildings,Eliminated – unclear/other
10.1016/j.jobe.2023.108403,2024,Indoor-outdoor NO<ce:inf loc=post>X</ce:inf> modelling in a single-side naturally ventilated room in a real building in Madrid,Journal of Building Engineering,Eliminated – unclear/other
10.1016/j.rser.2024.114701,2024,Systematic examination of energy performance gap in low-energy buildings,Renewable and Sustainable Energy Reviews,Eliminated – unclear/other
10.1016/j.enbuild.2024.114234,2024,A novel framework for assessing the smartness and the smart readiness level in highly electrified non-residential buildings: A Norwegian case study,Energy and Buildings,Eliminated – unclear/other
10.1016/j.jobe.2023.108157,2024,Priori knowledge-based deep reinforcement learning control for fan coil unit system,Journal of Building Engineering,KEEP – operational EE/control
10.1016/j.aei.2024.102470,2024,Statelets extraction-guided contrastive learning for detection of control performance degradation with varying degrees,Advanced Engineering Informatics,KEEP – operational EE/control
10.1016/j.enbuild.2024.114949,2024,Nature-inspired temperature-adaptive module: Achieving all-season passive thermal regulation for buildings,Energy and Buildings,Eliminated – unclear/other
10.1016/j.solener.2024.113031,2024,An Intra-Hour photovoltaic power generation prediction method for flexible building energy systems and its application in operation scheduling strategy,Solar Energy,KEEP – operational EE/control
10.1016/j.rser.2023.114235,2024,Multi-sensor data fusion framework for energy optimization in smart homes,Renewable and Sustainable Energy Reviews,Eliminated – unclear/other
10.1016/j.buildenv.2024.111436,2024,On the effect of pressure coefficient source on the energy demand of an isolated cross-ventilated building,Building and Environment,Eliminated – unclear/other
10.1016/j.enbuild.2024.114869,2024,Optimising building performance for a resilient Future: A Multi-Objective approach to Net Zero energy strategies,Energy and Buildings,Eliminated – unclear/other
10.1016/j.enbenv.2023.07.001,2024,Demystifying energy savings from dynamic temperature setpoints under weather and occupancy variability,Energy and Built Environment,KEEP – operational EE/control
10.1016/j.buildenv.2024.112070,2024,"Quantitative filter forensics for allergens and semivolatile organic compounds in residential buildings in Toronto, Canada",Building and Environment,Eliminated – unclear/other
10.1016/j.scs.2023.105025,2024,Evaluating carbon emissions from the operation of historic dwellings in cities based on an intelligent management platform,Sustainable Cities and Society,KEEP – operational EE/control
10.1016/j.buildenv.2024.111349,2024,How to measure and control indoor air quality based on intelligent digital twin platforms: A case study in China,Building and Environment,KEEP – operational EE/control
10.1016/j.ijrefrig.2024.01.006,2024,An intelligent fault detection and diagnosis model for refrigeration systems with a comprehensive feature selection method,International Journal of Refrigeration,KEEP – operational EE/control
10.1016/j.enbenv.2023.06.003,2024,Estimating cooling loads of Indian residences using building geometry data and multiple linear regression,Energy and Built Environment,Eliminated – unclear/other
10.1016/j.jobe.2024.108645,2024,Enabling portable demand flexibility control applications in virtual and real buildings,Journal of Building Engineering,KEEP – operational EE/control
10.1016/j.jobe.2024.110025,2024,Distribution and correlation analysis of typical features of electricity use profiles in non-residential buildings,Journal of Building Engineering,Eliminated – unclear/other
10.1016/j.apenergy.2024.123051,2024,"Household energy resilience in extreme weather events: An investigation of energy service importance, HVAC usage behaviors, and willingness to pay",Applied Energy,Eliminated – unclear/other
10.1016/j.applthermaleng.2024.122820,2024,Implementation of scalable performance monitoring method for air conditioners,Applied Thermal Engineering,Eliminated – Monitoring/Forecasting only
10.1016/j.jobe.2024.111030,2024,Energy scheduling strategy for energy hubs using reinforcement learning approach,Journal of Building Engineering,KEEP – operational EE/control
10.1016/j.applthermaleng.2023.122098,2024,Development of a dynamic demand response quantification and control framework for fan-coil air-conditioning systems based on prediction models,Applied Thermal Engineering,KEEP – operational EE/control
10.1016/j.jobe.2024.109519,2024,Global optimization strategy of prosumer data center system operation based on multi-agent deep reinforcement learning,Journal of Building Engineering,KEEP – operational EE/control
10.1016/j.jobe.2024.109757,2024,Application of multi-objective artificial gorilla troops optimization algorithm in intelligent evacuation path planning for building fires,Journal of Building Engineering,Eliminated – Planning/Top-down
10.1016/j.scs.2024.105603,2024,A novel quantitative method of heatwave classification for building resilience analysis,Sustainable Cities and Society,Eliminated – Monitoring/Forecasting only
10.1016/j.apenergy.2024.123259,2024,Optimal pricing of integrated community energy system for building prosumers with P2P multi-energy trading,Applied Energy,Eliminated – unclear/other
10.1016/j.jclepro.2024.144190,2024,Servitization for the energy transition: The case of enabling cooling-as-a-service (CaaS),Journal of Cleaner Production,Eliminated – unclear/other
10.1016/j.jobe.2024.109311,2024,"Fuzzy clustering-based climatic zoning method for building climate responsiveness in Qinba region, China",Journal of Building Engineering,Eliminated – Monitoring/Forecasting only
10.1016/j.jobe.2024.110948,2024,Experimental and theoretical study on building integrated radiative cooling with a limited sky-view factor,Journal of Building Engineering,Eliminated – Materials/Envelope
10.1016/j.enbuild.2024.114223,2024,Energy efficiency practices: A case study analysis of innovative business models in buildings,Energy and Buildings,Eliminated – unclear/other
10.1016/j.enbuild.2024.114215,2024,What’s the typical issues influencing operation performance of HVACs in super high-rise buildings? Field tests and optimization analysis,Energy and Buildings,KEEP – operational EE/control
10.1016/j.enbuild.2024.114402,2024,Global assessment of radiative cooling and low-emissivity coatings for energy efficiency in buildings across all climate zones,Energy and Buildings,Eliminated – Materials/Envelope
10.1016/j.enbuild.2024.114951,2024,A smart home energy management system based on human activity recognition and deep reinforcement learning,Energy and Buildings,KEEP – operational EE/control
10.1016/j.scs.2023.105056,2024,Impacts of humidity measurement uncertainties and an uncertainty-tolerant economizer control strategy for air-conditioning systems,Sustainable Cities and Society,KEEP – operational EE/control
10.1016/j.apenergy.2024.123740,2024,A distributionally robust optimization model for building-integrated photovoltaic system expansion planning under demand and irradiance uncertainties,Applied Energy,Eliminated – Renewable-only
10.1016/j.scs.2024.105319,2024,Assessment of energy and thermal resilience performance to inform climate mitigation of multifamily buildings in disadvantaged communities,Sustainable Cities and Society,Eliminated – unclear/other
10.1016/j.energy.2024.130420,2024,WiSOM: WiFi-enabled self-adaptive system for monitoring the occupancy in smart buildings,Energy,KEEP – operational EE/control
10.1016/j.ijepes.2024.110323,2024,Detecting energy theft with partially observed anomalies,International Journal of Electrical Power & Energy Systems,Eliminated – unclear/other
10.1016/j.ymssp.2024.111348,2024,Quantized information-theoretic learning based Laguerre functional linked neural networks for nonlinear active noise control,Mechanical Systems and Signal Processing,KEEP – operational EE/control
10.1016/j.energy.2024.132742,2024,Optimal strategy for transition into nearly zero energy residential buildings: A case study,Energy,Eliminated – unclear/other
10.1016/j.buildenv.2024.112101,2024,Is 3D building morphology really related to land surface temperature? Insights from a new homogeneous unit,Building and Environment,Eliminated – unclear/other
10.1016/j.aei.2023.102239,2024,Simultaneous in-situ calibration for physical and virtual sensors towards digital twin-enabled building operations,Advanced Engineering Informatics,KEEP – operational EE/control
10.1016/j.enbuild.2024.114794,2024,Experimental and computational assessment of an energy-saving innovation in a customised testing cabin,Energy and Buildings,Eliminated – unclear/other
10.1016/j.jobe.2024.111496,2024,Energy efficiency and cost benefits of office-to-residential building transformation: Insights from Los Angeles,Journal of Building Engineering,Eliminated – unclear/other
10.1016/j.apenergy.2024.123612,2024,"A holistic framework for the optimal design and operation of electricity, heating, cooling and hydrogen technologies in buildings",Applied Energy,KEEP – operational EE/control
10.1016/j.enbuild.2024.114694,2024,"Innovate, insulate, integrate: Embracing circular economy in innovative insulations for reduced air conditioning expenses and carbon mitigation in fly ash brick buildings",Energy and Buildings,Eliminated – Materials/Envelope
10.1016/j.enbuild.2024.114547,2024,Short-term thermal resilience and building energy flexibility using thermal mass and controlled natural ventilation,Energy and Buildings,KEEP – operational EE/control
10.1016/j.enbuild.2024.114482,2024,Understanding Residents’ energy consumption Profiles: Behavioral segmentation analysis of heat energy consumption in Korean apartment residences,Energy and Buildings,Eliminated – unclear/other
10.1016/j.buildenv.2024.111588,2024,Numerical investigation of evaporative cooling strategies on the aero-thermal performance of courtyard buildings in hot-dry climates,Building and Environment,Eliminated – unclear/other
10.1016/j.enbuild.2024.114423,2024,Optimization scheduling for low-carbon operation of building integrated energy systems considering source-load uncertainty and user comfort,Energy and Buildings,KEEP – operational EE/control
10.1016/j.buildenv.2023.111039,2024,Indoor environmental wellness index (IEW-Index): Towards intelligent building systems automation and optimization,Building and Environment,Eliminated – unclear/other
10.1016/j.apenergy.2024.124038,2024,"Energy examination and optimization workflow for container farms: A case study in Shanghai, China",Applied Energy,Eliminated – unclear/other
10.1016/j.ijhydene.2024.05.438,2024,Collective hydrogen stand-alone renewable energy systems for buildings in Spain. Towards the self-sufficiency,International Journal of Hydrogen Energy,Eliminated – Renewable-only
10.1016/j.scs.2024.105553,2024,A cloud-oriented data-analysis framework to analyze peak demand dynamics in institutional building clusters,Sustainable Cities and Society,Eliminated – unclear/other
10.1016/j.apenergy.2023.122473,2024,Innovative approaches for deep decarbonization of data centers and building space heating networks: Modeling and comparison of novel waste heat recovery systems for liquid cooling systems,Applied Energy,Eliminated – Other/Industry
10.1016/j.enbuild.2024.114162,2024,Two-stage optimization for the air conditioning system in public buildings with flexible control of indoor load,Energy and Buildings,KEEP – operational EE/control
10.1016/j.jobe.2024.111050,2024,Precision detection and identification method for apparent damage in timber components of historic buildings based on portable LiDAR equipment,Journal of Building Engineering,Eliminated – unclear/other
10.1016/j.enbuild.2024.114324,2024,Exploring insulation levels to enable low-temperature heating in selected buildings in two European climate zones,Energy and Buildings,Eliminated – Materials/Envelope
10.1016/j.enbuild.2024.114866,2024,Thermal conductivity assessment of cotton fibers from apparel recycling for building insulation,Energy and Buildings,Eliminated – Materials/Envelope
10.1016/j.apenergy.2024.123244,2024,Variational quantum circuit based demand response in buildings leveraging a hybrid quantum-classical strategy,Applied Energy,KEEP – operational EE/control
10.1016/j.rser.2023.114247,2024,Weather and climate data for energy applications,Renewable and Sustainable Energy Reviews,Eliminated – unclear/other
10.1016/j.measurement.2024.115264,2024,Application of multi-scale information semi-supervised learning network in vibrating screen operational state recognition,Measurement,KEEP – operational EE/control
10.1016/j.enbuild.2023.113807,2024,Exergy-based ecological network analysis for building and community energy systems,Energy and Buildings,Eliminated – unclear/other
10.1016/j.energy.2024.130303,2024,Demand-side energy management reimagined: A comprehensive literature analysis leveraging large language models,Energy,KEEP – operational EE/control
10.1016/j.enbenv.2023.06.005,2024,"Generative pre-trained transformers (GPT)-based automated data mining for building energy management: Advantages, limitations and the future",Energy and Built Environment,KEEP – operational EE/control
10.1016/j.jclepro.2024.141255,2024,The impact of climate change on an office building in Portugal: Measures for a higher energy performance,Journal of Cleaner Production,Eliminated – Planning/Top-down
10.1016/j.enbuild.2024.114287,2024,Impact of heating strategies towards energy-efficient buildings,Energy and Buildings,Eliminated – unclear/other
10.1016/j.jobe.2024.109328,2024,A Markov chain-based approach for assessing respiratory infection risk in a multi-zone office building,Journal of Building Engineering,Eliminated – unclear/other
10.1016/j.applthermaleng.2023.121606,2024,Comparison of various dual-temperature zones space heating systems based on energy cascade utilization principle,Applied Thermal Engineering,Eliminated – unclear/other
10.1016/j.apenergy.2024.124125,2024,Experimental study on the performance of enhanced air-cooled photovoltaic thermal energy-supplied manure treatment technology,Applied Energy,Eliminated – Renewable-only
10.1016/j.jobe.2024.110732,2024,Optimizing smart home appliance energy monitoring using Factorial Hidden Markov Models for Internet of Behavior,Journal of Building Engineering,Eliminated – Monitoring/Forecasting only
