DOI,Year,Title,Journal,Reason
10.1016/j.apenergy.2024.123586,2024,Exploring smart heat meter data: A co-clustering driven approach to analyse the energy use of single-family houses,Applied Energy,Eliminated – Monitoring/Forecasting only
10.1016/j.jobe.2024.111017,2024,Development and validation of intelligent load control for VRF air-conditioning system with deep learning based load forecasting,Journal of Building Engineering,KEEP – operational EE/control
10.1016/j.enbuild.2023.113829,2024,Predicting energy consumption of mosque buildings during the operation stage using deep learning approach,Energy and Buildings,KEEP – operational EE/control
10.1016/j.buildenv.2024.112121,2024,Educational environments’ energy demand optimization based on indoor CO<ce:inf loc=post>2</ce:inf> concentration and temperature: Together better than separately,Building and Environment,Eliminated – unclear/other
10.1016/j.enbuild.2024.114404,2024,Assessing the impact of the dataset’s size and quality on building thermal models for energy flexibility,Energy and Buildings,KEEP – operational EE/control
10.1016/j.enbuild.2024.113889,2024,Integrated building fault detection and diagnosis using data modeling and Bayesian networks,Energy and Buildings,KEEP – operational EE/control
10.1016/j.buildenv.2024.111236,2024,Assessing effects of future climate change on outdoor thermal stress and building energy performance in severe cold region of China,Building and Environment,Eliminated – Planning/Top-down
10.1016/j.enbenv.2024.12.005,2024,Unsupervised anomaly detection of industrial building energy consumption,Energy and Built Environment,Eliminated – Other/Industry
10.1016/j.jobe.2024.109758,2024,Multi-aspect analysis of measures to reduce the building's energy demand,Journal of Building Engineering,Eliminated – unclear/other
10.1016/j.enbuild.2024.114844,2024,Real-time optimal hierarchy control of HVAC system with maximized ancillary service support in smart buildings: An experimental approach,Energy and Buildings,KEEP – operational EE/control
10.1016/j.buildenv.2024.111356,2024,Enhancing individual thermal preference satisfaction and energy efficiency in multi-occupant spaces through stratified micro-environments,Building and Environment,KEEP – operational EE/control
10.1016/j.enbuild.2024.114434,2024,Self-detection of thermal ambient parameters for air-conditioned space by learning operation data and self-prediction of indoor temperature and power consumption,Energy and Buildings,KEEP – operational EE/control
10.1016/j.enbuild.2024.114546,2024,Quantification of inherent energy efficient features in historic buildings under hot and humid conditions,Energy and Buildings,Eliminated – unclear/other
10.1016/j.enbuild.2024.114802,2024,A portable application framework for energy management and information systems (EMIS) solutions using Brick semantic schema,Energy and Buildings,KEEP – operational EE/control
10.1016/j.buildenv.2023.111148,2024,Attention-empowered transfer learning method for HVAC sensor fault diagnosis in dynamic building environments,Building and Environment,Eliminated – unclear/other
10.1016/j.buildenv.2024.111422,2024,Assessing the post-COVID interaction between indoor environmental quality and occupants within educational buildings: A structural equation modeling approach,Building and Environment,KEEP – operational EE/control
10.1016/j.enbuild.2024.114511,2024,The impact of metering methods on collective self-consumption: Insights from multi-dwelling buildings in Finland,Energy and Buildings,Eliminated – unclear/other
10.1016/j.buildenv.2024.111319,2024,Exploring occupant detection model generalizability for residential buildings using supervised learning with IEQ sensors,Building and Environment,KEEP – operational EE/control
10.1016/j.energy.2024.132577,2024,Integrated demand response method for heating multiple rooms based on fuzzy logic considering dynamic price,Energy,KEEP – operational EE/control
10.1016/j.apenergy.2024.123960,2024,Uncovering the financial impact of energy-efficient building characteristics with eXplainable artificial intelligence,Applied Energy,Eliminated – unclear/other
10.1016/j.jobe.2024.111307,2024,Transfer entropy and LSTM deep learning-based faulty sensor data recovery method for building air-conditioning systems,Journal of Building Engineering,Eliminated – unclear/other
10.1016/j.scs.2023.105169,2024,UAV-based automated 3D modeling framework using deep learning for building energy modeling,Sustainable Cities and Society,Eliminated – unclear/other
10.1016/j.jobe.2024.111355,2024,Deep learning models for vision-based occupancy detection in high occupancy buildings,Journal of Building Engineering,KEEP – operational EE/control
10.1016/j.apenergy.2024.123447,2024,Real building implementation of a deep reinforcement learning controller to enhance energy efficiency and indoor temperature control,Applied Energy,KEEP – operational EE/control
10.1016/j.conengprac.2023.105793,2024,Multi-priority HVAC temperature control with resource constrained based on coordinated distributed zone MPC,Control Engineering Practice,KEEP – operational EE/control
10.1016/j.enbuild.2024.114418,2024,Climate change impact on energy savings in mixed-mode ventilation office buildings in Brazil,Energy and Buildings,Eliminated – Ventilation/IAQ only
10.1016/j.enbuild.2024.114885,2024,Performance analysis of particulate matter priority control algorithm for outdoor Air-Introduced ventilation Cleaner using prediction model,Energy and Buildings,KEEP – operational EE/control
10.1016/j.jobe.2024.110314,2024,A novel dynamic predictive control model for variable air volume air conditioning systems using deep learning,Journal of Building Engineering,KEEP – operational EE/control
10.1016/j.enbuild.2024.114072,2024,A new tool for energy conservation in operating room: The role of machine learning models in enhancing airflow control,Energy and Buildings,KEEP – operational EE/control
10.1016/j.enbuild.2024.114410,2024,Energy management based on safe multi-agent reinforcement learning for smart buildings in distribution networks,Energy and Buildings,KEEP – operational EE/control
10.1016/j.enbuild.2024.114378,2024,An entropy-based causality framework for cross-level faults diagnosis and isolation in building HVAC systems,Energy and Buildings,Eliminated – unclear/other
10.1016/j.enbuild.2024.114905,2024,Research on a novel method of air distribution to create a uniform indoor environment in a long and narrow building,Energy and Buildings,Eliminated – Ventilation/IAQ only
10.1016/j.enbuild.2024.114965,2024,Combining energy generation and radiant systems: Challenges and possibilities for plus energy buildings,Energy and Buildings,Eliminated – unclear/other
10.1016/j.enbuild.2024.114028,2024,Energy characterization of buildings in polar climate: Case study of <ce:italic>Gabriel de Castilla</ce:italic> Antarctic station,Energy and Buildings,Eliminated – unclear/other
10.1016/j.enbuild.2024.114222,2024,From layer to building: Multiscale modeling of thermo-optical properties in 3D-printed facades,Energy and Buildings,Eliminated – unclear/other
10.1016/j.scitotenv.2024.175104,2024,"Evaluating the effect of passive cooling strategies in school buildings on children's well-being in Barcelona: A quasi-experimental, mixed methods study",Science of The Total Environment,Eliminated – unclear/other
10.1016/j.jobe.2024.110694,2024,A heat-measurement-free strategy for Economic Model Predictive Control of hydronic radiators,Journal of Building Engineering,KEEP – operational EE/control
10.1016/j.jobe.2024.108654,2024,Thermal demand characteristics of elderly people with varying levels of frailty in residential buildings during the summer,Journal of Building Engineering,Eliminated – unclear/other
10.1016/j.jobe.2024.109740,2024,Structural analysis for a slab-on-grade cellular concrete foundation to reduce heat losses in temperate climate residential buildings,Journal of Building Engineering,Eliminated – unclear/other
10.1016/j.enbenv.2024.07.002,2024,Parametric analysis of a novel rotary scoop dual-channel windcatcher for multi-directional natural ventilation of buildings,Energy and Built Environment,Eliminated – Renewable-only
10.1016/j.apenergy.2024.123998,2024,Adaptive multi-agent reinforcement learning for flexible resource management in a virtual power plant with dynamic participating multi-energy buildings,Applied Energy,KEEP – operational EE/control
10.1016/j.enbuild.2024.114030,2024,Enhancing climate resilience in buildings using Collective Intelligence: A pilot study on a Norwegian elderly care center,Energy and Buildings,Eliminated – unclear/other
10.1016/j.buildenv.2024.111864,2024,An artificial neural network based approach to air supply control in large indoor spaces considering occupancy dynamics,Building and Environment,KEEP – operational EE/control
10.1016/j.apenergy.2023.122456,2024,Energy management in citizen energy communities: A flexibility-constrained robust optimization approach considering prosumers comfort,Applied Energy,KEEP – operational EE/control
10.1016/j.buildenv.2024.111869,2024,An adaptive framework for assessing climate resilience in buildings,Building and Environment,Eliminated – unclear/other
10.1016/j.buildenv.2024.111355,2024,DMFF: Deep multimodel feature fusion for building occupancy detection,Building and Environment,KEEP – operational EE/control
10.1016/j.jobe.2024.109937,2024,"Application of a combination of innovative non-destructive measurement techniques for structural, energetic and safety analysis of buildings",Journal of Building Engineering,Eliminated – unclear/other
10.1016/j.jobe.2024.108817,2024,Ranking building design and operation parameters for residential heating demand forecasting with machine learning,Journal of Building Engineering,KEEP – operational EE/control
10.1016/j.jobe.2024.110785,2024,Machine learning-based approach for assessing the seismic vulnerability of reinforced concrete frame buildings,Journal of Building Engineering,Eliminated – unclear/other
10.1016/j.enbuild.2023.113790,2024,"Development, implementation, and impact analysis of model predictive control-based optimal precooling using smart home thermostats",Energy and Buildings,KEEP – operational EE/control
10.1016/j.jobe.2024.108582,2024,Enhancing indoor comfort and building energy efficiency with cross-laminated timber (CLT) in hygrothermal environments,Journal of Building Engineering,Eliminated – unclear/other
10.1016/j.apenergy.2024.122741,2024,Interpretable domain-informed and domain-agnostic features for supervised and unsupervised learning on building energy demand data,Applied Energy,Eliminated – unclear/other
10.1016/j.jobe.2024.111182,2024,Energy efficiency prediction of refrigerating station system based on BP neural network and optimization of operating strategy,Journal of Building Engineering,Eliminated – Monitoring/Forecasting only
10.1016/j.enbuild.2024.114528,2024,Model-based control strategy with linear parameter-varying state-space model for rack-based cooling data centers,Energy and Buildings,KEEP – operational EE/control
10.1016/j.energy.2024.133819,2024,"Household, sociodemographic, building and land cover factors affecting residential summer electricity consumption: A systematic statistical study in Phoenix, AZ",Energy,Eliminated – unclear/other
10.1016/j.enbuild.2024.114799,2024,Individual room air-conditioning control in high-insulation residential building during winter: A deep reinforcement learning-based control model for reducing energy consumption,Energy and Buildings,KEEP – operational EE/control
10.1016/j.enbuild.2024.114563,2024,Comparing different parameter identification techniques for optimal control of building energy systems,Energy and Buildings,KEEP – operational EE/control
10.1016/j.applthermaleng.2024.123009,2024,Theoretical and experimental research on the performance of new building environment control systems based on cooling dehumidification under positive pressure,Applied Thermal Engineering,KEEP – operational EE/control
10.1016/j.autcon.2023.105261,2024,Neural network-based nonintrusive calibration for an unobserved model in digital twin-enabled building operations,Automation in Construction,KEEP – operational EE/control
10.1016/j.enbuild.2023.113760,2024,A transfer learning approach to minimize reinforcement learning risks in energy optimization for automated and smart buildings,Energy and Buildings,KEEP – operational EE/control
10.1016/j.aei.2024.102868,2024,Graph Neural Networks for building and civil infrastructure operation and maintenance enhancement,Advanced Engineering Informatics,KEEP – operational EE/control
10.1016/j.enbuild.2024.114176,2024,WiSA: Privacy-enhanced WiFi-based activity intensity recognition in smart buildings using personalized federated learning,Energy and Buildings,Eliminated – unclear/other
10.1016/j.buildenv.2024.111925,2024,"A framework for assessing the energy performance of Personalized Environmental Control Systems (PECS) for heating, cooling and ventilation",Building and Environment,KEEP – operational EE/control
10.1016/j.aei.2024.102810,2024,Autoencoder-Based fault detection using building automation system data,Advanced Engineering Informatics,KEEP – operational EE/control
10.1016/j.jobe.2024.111080,2024,Prospects and challenges of reinforcement learning- based HVAC control,Journal of Building Engineering,KEEP – operational EE/control
10.1016/j.apenergy.2024.124004,2024,An adaptive switching control model for air conditioning systems based on information completeness,Applied Energy,KEEP – operational EE/control
10.1016/j.enbuild.2024.114691,2024,Exploring automated energy optimization with unstructured building data: A multi-agent based framework leveraging large language models,Energy and Buildings,Eliminated – unclear/other
10.1016/j.buildenv.2023.111115,2024,A novel air balancing method based on an improved perceptron under multiple constraints for the energy conservation of ventilation system,Building and Environment,Eliminated – Ventilation/IAQ only
10.1016/j.enbuild.2024.114811,2024,Circuit categorization approach of office building energy consumption based on data features for energy-saving diagnosis,Energy and Buildings,Eliminated – unclear/other
10.1016/j.jobe.2024.111376,2024,Optimization research on the air infection intervention ability of interactive cascade ventilation in high-density building spaces,Journal of Building Engineering,Eliminated – Ventilation/IAQ only
10.1016/j.enbuild.2024.114112,2024,Influence of coupling air conditioner with hybrid PCMs on building interior conditions and consumed power: Experimental investigation,Energy and Buildings,Eliminated – unclear/other
10.1016/j.ijhydene.2023.03.373,2024,Dynamic fault detection and diagnosis of industrial alkaline water electrolyzer process with variational Bayesian dictionary learning,International Journal of Hydrogen Energy,KEEP – operational EE/control
10.1016/j.jobe.2023.108295,2024,Life cycle energy and greenhouse gas emissions of a traditional and a smart HVAC control system for Australian office buildings,Journal of Building Engineering,KEEP – operational EE/control
10.1016/j.renene.2024.121836,2024,Coupled complementary operation and optimal planning of energy-water nexus synergies: Balancing water demand and renewable energy production,Renewable Energy,KEEP – operational EE/control
10.1016/j.enbuild.2024.114457,2024,Advancing industrial building energy measurement and verification (M&V) with deep learning: Evaluating data size and feature selection impact,Energy and Buildings,Eliminated – Other/Industry
10.1016/j.jobe.2023.108246,2024,Numerical modeling of non-uniform indoor temperature distribution for coordinated air flow control,Journal of Building Engineering,KEEP – operational EE/control
10.1016/j.jobe.2024.110410,2024,Hybrid model-free control based on deep reinforcement learning: An energy-efficient operation strategy for HVAC systems,Journal of Building Engineering,KEEP – operational EE/control
10.1016/j.buildenv.2024.112092,2024,Awareness-guided incremental control optimization for chilled water system with deep learning model under cold-start scenarios,Building and Environment,KEEP – operational EE/control
10.1016/j.apenergy.2024.123888,2024,A dynamic model of wrist-worn rotational electret energy harvester: Theoretical investigation and experimental validations,Applied Energy,Eliminated – unclear/other
10.1016/j.aei.2024.102614,2024,Automated fire risk assessment and mitigation in building blueprints using computer vision and deep generative models,Advanced Engineering Informatics,Eliminated – unclear/other
10.1016/j.enbuild.2024.115035,2024,A knowledge graph-based framework to automate the generation of building energy models using geometric relation checking and HVAC topology establishment,Energy and Buildings,Eliminated – unclear/other
10.1016/j.enbuild.2023.113811,2024,"Thermal modeling for control applications of 60,000 homes in North America using smart thermostat data",Energy and Buildings,KEEP – operational EE/control
10.1016/j.enbenv.2024.04.009,2024,Energy-saving regulation methods and energy consumption characteristics of office air-conditioning loads in hot summer and cold winter areas,Energy and Built Environment,Eliminated – unclear/other
10.1016/j.jobe.2024.110028,2024,Distributed model predictive control of fan coil system,Journal of Building Engineering,KEEP – operational EE/control
10.1016/j.enbuild.2024.115043,2024,The role of advanced energy management strategies to operate flexibility sources in Renewable Energy Communities,Energy and Buildings,KEEP – operational EE/control
10.1016/j.enbuild.2024.114474,2024,A new integrated framework to fault detection and diagnosis of air handling unit: Emphasizing the impact of symptoms,Energy and Buildings,KEEP – operational EE/control
10.1016/j.buildenv.2023.111155,2024,Subzone division optimization with probability analysis-based K-means clustering for coupled control of non-uniform thermal environments and individual thermal preferences,Building and Environment,KEEP – operational EE/control
10.1016/j.scs.2024.105667,2024,Profiling residential energy vulnerability: Bayesian-based spatial mapping of occupancy and building characteristics,Sustainable Cities and Society,KEEP – operational EE/control
10.1016/j.apenergy.2024.123840,2024,Digital twin-driven energy consumption management of integrated heat pipe cooling system for a data center,Applied Energy,Eliminated – Other/Industry
10.1016/j.jobe.2024.110697,2024,Developing an automatic integration approach to generate brick model from imperfect building information modelling,Journal of Building Engineering,Eliminated – unclear/other
10.1016/j.enbuild.2024.114229,2024,Grey-box modeling for thermal dynamics of buildings under the presence of unmeasured internal heat gains,Energy and Buildings,Eliminated – unclear/other
10.1016/j.jobe.2023.108388,2024,Bioclimatic classification for building energy efficiency using hierarchical clustering: A case study for Sri Lanka,Journal of Building Engineering,Eliminated – Monitoring/Forecasting only
10.1016/j.apenergy.2024.123431,2024,EPlus-LLM: A large language model-based computing platform for automated building energy modeling,Applied Energy,Eliminated – unclear/other
10.1016/j.enbuild.2024.114084,2024,Experimental and numerical investigation on energy-saving performance of radiative cooling coating for metal container office,Energy and Buildings,Eliminated – Materials/Envelope
10.1016/j.autcon.2024.105823,2024,Virtual in-situ modeling between digital twin and BIM for advanced building operations and maintenance,Automation in Construction,KEEP – operational EE/control
10.1016/j.apenergy.2024.124224,2024,Application to novel smart techniques for decarbonization of commercial building heating and cooling through optimal energy management,Applied Energy,KEEP – operational EE/control
10.1016/j.apenergy.2024.122943,2024,A machine learning-based framework for clustering residential electricity load profiles to enhance demand response programs,Applied Energy,KEEP – operational EE/control
10.1016/j.enbuild.2024.114516,2024,Development of a DNN model using calibrated simulation for the optimal control of HVAC systems,Energy and Buildings,KEEP – operational EE/control
10.1016/j.energy.2024.133641,2024,Redefining realistic and stochastic occupancy schedules and patterns for residential buildings in Jordan,Energy,KEEP – operational EE/control
10.1016/j.energy.2024.130812,2024,Low-order gray-box modeling of heating buildings and the progressive dimension reduction identification of uncertain model parameters,Energy,Eliminated – unclear/other
10.1016/j.enbuild.2023.113812,2024,Enhancing real-time nonintrusive occupancy estimation in buildings via knowledge fusion network,Energy and Buildings,KEEP – operational EE/control
10.1016/j.enbuild.2024.114509,2024,High-accuracy occupancy counting at crowded entrances for smart buildings,Energy and Buildings,KEEP – operational EE/control
10.1016/j.buildenv.2024.111489,2024,"OntoAgency: An agency-based ontology for tracing control, ownership and decision-making in smart buildings",Building and Environment,KEEP – operational EE/control
10.1016/j.scitotenv.2024.170085,2024,"Carbon capture, utilization and sequestration systems design and operation optimization: Assessment and perspectives of artificial intelligence opportunities",Science of The Total Environment,KEEP – operational EE/control
10.1016/j.jobe.2024.110033,2024,Evacuation scenario optimization in buildings with human anthropometric characteristics,Journal of Building Engineering,Eliminated – Planning/Top-down
10.1016/j.scs.2024.105664,2024,An integrated price- and incentive-based demand response program for smart residential buildings: A robust multi-objective model,Sustainable Cities and Society,KEEP – operational EE/control
10.1016/j.enbuild.2024.114289,2024,Advances in emerging digital technologies for energy efficiency and energy integration in smart cities,Energy and Buildings,Eliminated – unclear/other
10.1016/j.energy.2024.132578,2024,Infrared signal-based implementation of model-based predictive control (MPC) for cost saving in a campus building,Energy,KEEP – operational EE/control
10.1016/j.autcon.2024.105387,2024,Cellular network-based IIoT architecture for time-critical control tasks of building automation,Automation in Construction,KEEP – operational EE/control
10.1016/j.buildenv.2024.111385,2024,Unraveling the complexities: Impacts of energy burden on the built environment challenges among assistance-dependent populations in the United Kingdom,Building and Environment,Eliminated – unclear/other
10.1016/j.scs.2024.105486,2024,Scaled outdoor experiments to assess impacts of tree evapotranspiration and shading on microclimates and energy fluxes in 2D street canyons,Sustainable Cities and Society,Eliminated – unclear/other
10.1016/j.jobe.2024.109686,2024,Comparing the life cycle costs of a traditional and a smart HVAC control system for Australian office buildings,Journal of Building Engineering,KEEP – operational EE/control
10.1016/j.enbenv.2024.07.006,2024,Thermoeconomic assessment of the air-cooled tropical data center through energy-saving strategies,Energy and Built Environment,Eliminated – Other/Industry
10.1016/j.ijrefrig.2024.10.018,2024,A comparative performance study of terminal control strategy for the multi-split backplane cooling system in data centers,International Journal of Refrigeration,KEEP – operational EE/control
10.1016/j.renene.2024.120110,2024,From Net Zero Energy Buildings to an energy sharing model - The role of NZEBs in Renewable Energy Communities,Renewable Energy,Eliminated – Renewable-only
10.1016/j.enbuild.2024.114368,2024,Applying OPTICS with and without PCA for fault detection of fan coil units using building automation system data,Energy and Buildings,KEEP – operational EE/control
10.1016/j.buildenv.2024.111790,2024,Coupling effects of building-vegetation-land on seasonal land surface temperature on street-level: A study from a campus in Beijing,Building and Environment,Eliminated – unclear/other
10.1016/j.solener.2024.112511,2024,Characteristics of vertical temperature gradient in offices and its impact on air conditioning energy consumption,Solar Energy,Eliminated – unclear/other
10.1016/j.jobe.2024.110813,2024,A simplified model for seismic risk assessment of three-dimensional irregular steel moment frame buildings,Journal of Building Engineering,Eliminated – unclear/other
10.1016/j.jobe.2024.111303,2024,Bottom-up method to derive cost curves for space heating savings in residential buildings for all European countries,Journal of Building Engineering,Eliminated – unclear/other
10.1016/j.jobe.2024.111385,2024,Encrypted fully model-free event-triggered HVAC control,Journal of Building Engineering,KEEP – operational EE/control
10.1016/j.enbuild.2024.114446,2024,Spatial distribution of energy consumption: Integrating climate and macro-statistics for insights from clustering and sensitivity analysis,Energy and Buildings,Eliminated – Monitoring/Forecasting only
10.1016/j.jobe.2024.111134,2024,Reliably estimating the impact of an active control strategy in a building,Journal of Building Engineering,KEEP – operational EE/control
10.1016/j.buildenv.2023.111110,2024,How occupant positioning systems can be applied to help historic residences manage energy consumption: A case study in China,Building and Environment,KEEP – operational EE/control
10.1016/j.energy.2024.132977,2024,An Alternative Reinforcement Learning (ARL) control strategy for data center air-cooled HVAC systems,Energy,KEEP – operational EE/control
