DOI,Year,Title,Journal,Reason
10.1016/j.enbuild.2023.113471,2023,Machine learning based simultaneous control of air handling unit discharge air and condenser water temperatures set-point for minimized cooling energy in an office building,Energy and Buildings,KEEP – operational EE/control
10.1016/j.apenergy.2022.120353,2023,Values of coordinated residential space heating in demand response provision,Applied Energy,KEEP – operational EE/control
10.1016/j.buildenv.2023.110595,2023,Investigations on machine learning-based control-oriented modeling using historical thermal data of buildings,Building and Environment,KEEP – operational EE/control
10.1016/j.buildenv.2023.110033,2023,Quantify the magnitude and energy impact of overcooling in a sub-tropical campus building,Building and Environment,Eliminated – unclear/other
10.1016/j.enbuild.2023.112998,2023,Overheating analysis of optimized nearly Zero-Energy dwelling during current and future heatwaves coincided with cooling system outage,Energy and Buildings,Eliminated – unclear/other
10.1016/j.jclepro.2023.137917,2023,Global sensitivity analysis based on multi-objective optimization of rural tourism building performance,Journal of Cleaner Production,Eliminated – unclear/other
10.1016/j.enbuild.2022.112599,2023,Unlocking demand response in commercial buildings: Empirical response of commercial buildings to daily cooling set point adjustments,Energy and Buildings,KEEP – operational EE/control
10.1016/j.energy.2022.125705,2023,A methodology to estimate space heating and domestic hot water energy demand profile in residential buildings from low-resolution heat meter data,Energy,Eliminated – unclear/other
10.1016/j.jobe.2023.106040,2023,Modelling virtual sensors for real-time indoor comfort control,Journal of Building Engineering,KEEP – operational EE/control
10.1016/j.enbuild.2023.113668,2023,A comparative study of the whole life carbon of a radiant system and an all-air system in a non-residential building,Energy and Buildings,Eliminated – unclear/other
10.1016/j.jobe.2023.106283,2023,Automatic building height estimation with shadow correction over heterogeneous compact cities using stereo Gaofen-7 data at sub-meter resolution,Journal of Building Engineering,Eliminated – Monitoring/Forecasting only
10.1016/j.jobe.2023.107978,2023,A multi-objective optimization framework for building performance under climate change,Journal of Building Engineering,Eliminated – Planning/Top-down
10.1016/j.enbuild.2023.113476,2023,"Multiobjective optimization of daylighting, energy, and thermal performance for form variables in atrium buildings in China's hot summer and cold winter climate",Energy and Buildings,Eliminated – unclear/other
10.1016/j.energy.2022.126337,2023,An evolving learning-based fault detection and diagnosis method: Case study for a passive chilled beam system,Energy,KEEP – operational EE/control
10.1016/j.jobe.2023.106280,2023,"Development and application of an experimental framework for the use of virtual reality to assess building users’ productivity, comfort, and adaptive-behaviour",Journal of Building Engineering,Eliminated – unclear/other
10.1016/j.scs.2023.104960,2023,Parametric study of an active-passive system for cooling application in buildings improved with free cooling for enhanced solidification,Sustainable Cities and Society,Eliminated – unclear/other
10.1016/j.enbuild.2023.113199,2023,Microclimatic control of a fourteenth-century Church in Italy: The design of systems by experiments and simulations,Energy and Buildings,KEEP – operational EE/control
10.1016/j.energy.2023.128579,2023,New method of integrating experiment for maintaining low indoor temperature into numerical modelling: A feasibility demonstration in reduced-scale building model,Energy,Eliminated – unclear/other
10.1016/j.enbuild.2023.112772,2023,Application potential analysis of different control strategies for radiant floor cooling systems in office buildings in different climate zones of China,Energy and Buildings,KEEP – operational EE/control
10.1016/j.apenergy.2023.121364,2023,"Performance, robustness, and portability of imitation-assisted reinforcement learning policies for shading and natural ventilation control",Applied Energy,KEEP – operational EE/control
10.1016/j.enbuild.2023.113707,2023,Development of prediction models for thermostat override behavior in direct load control events,Energy and Buildings,KEEP – operational EE/control
10.1016/j.jobe.2023.107272,2023,Systematic analysis method of sensor and actuator faults propagation and impacts for optimally controlled complex building chilled water systems,Journal of Building Engineering,KEEP – operational EE/control
10.1016/j.buildenv.2023.110319,2023,Learning building occupants’ indoor environmental quality complaints and dissatisfaction from text-mining Booking.com reviews in the United States,Building and Environment,KEEP – operational EE/control
10.1016/j.buildenv.2023.110435,2023,Ten questions concerning reinforcement learning for building energy management,Building and Environment,KEEP – operational EE/control
10.1016/j.enbuild.2022.112646,2023,Thermal performance analysis of an existing building heating based on a novel active phase change heater,Energy and Buildings,Eliminated – unclear/other
10.1016/j.enbuild.2023.112969,2023,The adoption of pressure independent control valves (PICVs) for the simultaneous optimization of energy consumption and comfort in buildings,Energy and Buildings,KEEP – operational EE/control
10.1016/j.buildenv.2023.110195,2023,Implementation of ISO/DIS 52016-3 for adaptive façades: A case study of an office building,Building and Environment,Eliminated – unclear/other
10.1016/j.jobe.2022.105683,2023,Machine learning-based algorithms to estimate thermal dynamics of residential buildings with energy flexibility,Journal of Building Engineering,KEEP – operational EE/control
10.1016/j.jobe.2022.105509,2023,Mining operation hours on time-series energy data to identify unnecessary building energy consumption,Journal of Building Engineering,KEEP – operational EE/control
10.1016/j.buildenv.2022.109952,2023,Analysis of predicted mean vote-based model predictive control for residential HVAC systems,Building and Environment,KEEP – operational EE/control
10.1016/j.jobe.2023.106859,2023,"Air infiltration and related building energy consumption: A case study of office buildings in Changsha, China",Journal of Building Engineering,Eliminated – Ventilation/IAQ only
10.1016/j.buildenv.2023.110652,2023,In situ model fusion for building digital twinning,Building and Environment,Eliminated – unclear/other
10.1016/j.applthermaleng.2022.119899,2023,Effects of operation parameters on the ventilation performance for a floor-standing air conditioner,Applied Thermal Engineering,KEEP – operational EE/control
10.1016/j.jobe.2023.106852,2023,Comparative study of model-based and model-free reinforcement learning control performance in HVAC systems,Journal of Building Engineering,KEEP – operational EE/control
10.1016/j.enbuild.2023.113681,2023,Analysing the indoor temperature ranges for an efficient control of HVAC systems,Energy and Buildings,KEEP – operational EE/control
10.1016/j.scs.2023.104683,2023,Improvements of stratified micro-environments on the satisfaction of individual thermal preferences and energy-efficiency,Sustainable Cities and Society,Eliminated – unclear/other
10.1016/j.jobe.2023.107621,2023,Extended Kalman filter based extremum seeking algorithm for model-free control of building thermal environment under uncertainty,Journal of Building Engineering,KEEP – operational EE/control
10.1016/j.enbuild.2023.113295,2023,Optimization-informed rule extraction for HVAC system: A case study of dedicated outdoor air system control in a mixed-humid climate zone,Energy and Buildings,KEEP – operational EE/control
10.1016/j.enbuild.2022.112752,2023,A novel method of creating machine learning-based time series <ce:italic>meta</ce:italic>-models for building energy analysis,Energy and Buildings,Eliminated – unclear/other
10.1016/j.energy.2023.129307,2023,Unleashing wastewater heat Recovery's potential in smart building systems: Grey wolf-assisted optimization aided by artificial neural networks,Energy,Eliminated – unclear/other
10.1016/j.apenergy.2022.120622,2023,Hybrid modeling-based temperature and humidity adaptive control for a multi-zone HVAC system,Applied Energy,KEEP – operational EE/control
10.1016/j.enbuild.2023.113533,2023,Energy flexibility of commercial buildings for demand response applications in Australia,Energy and Buildings,KEEP – operational EE/control
10.1016/j.jobe.2023.108098,2023,Handling fault detection and diagnosis in incomplete sensor measurements for BAS based HVAC system,Journal of Building Engineering,KEEP – operational EE/control
10.1016/j.enbuild.2023.113341,2023,Development of a soft sensor for thermal inertia-based building electrical demand flexibility,Energy and Buildings,KEEP – operational EE/control
10.1016/j.enbuild.2022.112710,2023,Assessing and mitigating overheating risk in existing Canadian school buildings under extreme current and future climates,Energy and Buildings,Eliminated – unclear/other
10.1016/j.buildenv.2023.110427,2023,Computer-vision-assisted subzone-level demand-controlled ventilation with fast occupancy adaptation for large open spaces towards balanced IAQ and energy performance,Building and Environment,KEEP – operational EE/control
10.1016/j.energy.2023.126874,2023,Energy cost and consumption reduction of an office building by Chaotic Satin Bowerbird Optimization Algorithm with model predictive control and artificial neural network: A case study,Energy,KEEP – operational EE/control
10.1016/j.enbuild.2023.113127,2023,"Thermal modeling of existing buildings in high-fidelity simulators: A novel, practical methodology",Energy and Buildings,Eliminated – unclear/other
10.1016/j.scitotenv.2023.166109,2023,School building energy efficiency and NO<ce:inf loc=post>2</ce:inf> related risk of childhood asthma in England and Wales: Modelling study,Science of The Total Environment,Eliminated – unclear/other
10.1016/j.buildenv.2023.110188,2023,Estimating energy consumption of residential buildings at scale with drive-by image capture,Building and Environment,Eliminated – unclear/other
10.1016/j.jobe.2023.106564,2023,Quantifying thermal resilience of office buildings during power outages: Development of a simplified model metric and validation through experimentation,Journal of Building Engineering,Eliminated – unclear/other
10.1016/j.buildenv.2023.110620,2023,Equation-based modeling and optimization-based parameter estimation in multimodal virtual sensing platforms for smart buildings,Building and Environment,Eliminated – Monitoring/Forecasting only
10.1016/j.buildenv.2023.110171,2023,Improvement of thermomechanical properties of porous plaster reinforced with a network of Morocco sheep wool skeletons for Energy efficiency,Building and Environment,KEEP – operational EE/control
10.1016/j.enbuild.2023.112831,2023,Customer segmentation based on smart meter data analytics: Behavioral similarities with manual categorization for building types,Energy and Buildings,Eliminated – unclear/other
10.1016/j.buildenv.2023.110278,2023,An individual weightage for indoor environmental quality component to enhance work performance in office buildings,Building and Environment,Eliminated – unclear/other
10.1016/j.apenergy.2023.121785,2023,CIRLEM: a synergic integration of Collective Intelligence and Reinforcement learning in Energy Management for enhanced climate resilience and lightweight computation,Applied Energy,KEEP – operational EE/control
10.1016/j.buildenv.2023.110621,2023,Impact of building density on natural ventilation potential and cooling energy saving across Chinese climate zones,Building and Environment,Eliminated – Ventilation/IAQ only
10.1016/j.buildenv.2023.110726,2023,"Measuring, representing and analysing indoor soundscapes: A data collection campaign in residential buildings with natural and mechanical ventilation in England",Building and Environment,Eliminated – Ventilation/IAQ only
10.1016/j.jobe.2023.105859,2023,Thermal sensation and occupancy-based cooperative control method for multi-zone VAV air-conditioning systems,Journal of Building Engineering,KEEP – operational EE/control
10.1016/j.jobe.2023.106896,2023,"Building decarbonization by means of ancient techniques. Assessment of environmental impact, energy performance and mechanical safety",Journal of Building Engineering,Eliminated – unclear/other
10.1016/j.enbuild.2022.112702,2023,Sub-ambient cooling effect and net energy efficiency of a super-amphiphobic self-cleaning passive sub-ambient daytime radiative cooling coating applied to various buildings,Energy and Buildings,Eliminated – Materials/Envelope
10.1016/j.enbuild.2023.112882,2023,Is IoT monitoring key to improve building energy efficiency? Case study of a smart campus in Spain,Energy and Buildings,Eliminated – Monitoring/Forecasting only
10.1016/j.buildenv.2023.110350,2023,An XGBoost-Based predictive control strategy for HVAC systems in providing day-ahead demand response,Building and Environment,KEEP – operational EE/control
10.1016/j.jobe.2023.105830,2023,Comparison of the characteristics of the control strategies based on artificial neural network and genetic algorithm for air conditioning systems,Journal of Building Engineering,KEEP – operational EE/control
10.1016/j.scs.2023.104586,2023,Exploring spatial and environmental heterogeneity affecting energy consumption in commercial buildings using machine learning,Sustainable Cities and Society,Eliminated – unclear/other
10.1016/j.apenergy.2022.120223,2023,Transfer learning for multi-objective non-intrusive load monitoring in smart building,Applied Energy,Eliminated – Monitoring/Forecasting only
10.1016/j.renene.2023.118975,2023,Development of energy aggregators for virtual communities: The energy efficiency-flexibility nexus for demand response,Renewable Energy,KEEP – operational EE/control
10.1016/j.scs.2022.104317,2023,Model predictive control of a building renewable energy system based on a long short-term hybrid model,Sustainable Cities and Society,KEEP – operational EE/control
10.1016/j.energy.2023.128637,2023,Topology optimization of thermally activated building system in high-rise building,Energy,Eliminated – unclear/other
10.1016/j.conengprac.2023.105536,2023,Implementation of model predictive indoor climate control for hierarchical building energy management,Control Engineering Practice,KEEP – operational EE/control
10.1016/j.jobe.2023.106923,2023,Detecting thermal anomalies in buildings using frequency and temporal domains analysis,Journal of Building Engineering,Eliminated – unclear/other
10.1016/j.jobe.2023.106272,2023,Development and validation of mobile app and data management system for intelligent control of indoor thermal environment,Journal of Building Engineering,KEEP – operational EE/control
10.1016/j.apenergy.2022.120635,2023,Anomaly detection based on joint spatio-temporal learning for building electricity consumption,Applied Energy,Eliminated – unclear/other
10.1016/j.jobe.2023.106045,2023,"Analysis on the energy efficiency, thermal performance and infection intervention characteristics of interactive cascade ventilation (ICV)",Journal of Building Engineering,Eliminated – Ventilation/IAQ only
10.1016/j.enbuild.2023.113484,2023,A water spraying box and its improving effect on the thermal environment around multi-story residential buildings to reduce released heat from air-conditioning units,Energy and Buildings,Eliminated – unclear/other
10.1016/j.scitotenv.2023.162779,2023,Human thermal physiological response of wearing personal protective equipment: An educational building semi-open space experimental investigation,Science of The Total Environment,Eliminated – unclear/other
10.1016/j.jobe.2023.106698,2023,Effects of complex spatial atrium geometric parameters on the energy performance of hotels in a cold climate zone in China,Journal of Building Engineering,Eliminated – unclear/other
10.1016/j.enbuild.2023.113584,2023,Wireless water consumption sensing system for building energy efficiency: A visual-based approach with self-powered operation,Energy and Buildings,KEEP – operational EE/control
10.1016/j.enbuild.2023.113604,2023,Identifying rural high energy intensity residential buildings using metered data,Energy and Buildings,Eliminated – unclear/other
10.1016/j.jobe.2023.107372,2023,Small-scale experiments on the operational performance of a lightweight thermally active building system,Journal of Building Engineering,KEEP – operational EE/control
10.1016/j.enbuild.2023.113026,2023,Field test of Model Predictive Control in residential buildings for utility cost savings,Energy and Buildings,KEEP – operational EE/control
10.1016/j.buildenv.2022.109898,2023,Weighting of indoor environment quality parameters for occupant satisfaction and energy efficiency,Building and Environment,KEEP – operational EE/control
10.1016/j.enbuild.2022.112700,2023,Categorising the existing irradiance based blind control occupant behavior models (BC-OBMs) using unsupervised machine learning approach: A case of office building in India,Energy and Buildings,KEEP – operational EE/control
10.1016/j.rser.2023.113612,2023,Similarity learning-based fault detection and diagnosis in building HVAC systems with limited labeled data,Renewable and Sustainable Energy Reviews,KEEP – operational EE/control
10.1016/j.apenergy.2022.120526,2023,Federated reinforcement learning for smart building joint peer-to-peer energy and carbon allowance trading,Applied Energy,KEEP – operational EE/control
10.1016/j.jobe.2023.106651,2023,"Resilient or resistant to non-neutral environments? A comparative study on occupant thermal needs in buildings under natural ventilation, fee-free heating, and fee-charged heating modes",Journal of Building Engineering,KEEP – operational EE/control
10.1016/j.jobe.2023.108059,2023,A virtual sensor network for pressure distribution inside a multi-zone building based on spatial adjacency relationships and multivariate adaptive regression spline,Journal of Building Engineering,Eliminated – unclear/other
10.1016/j.energy.2022.125289,2023,The use of a thermal diode bridge for passive temperature control in the built environment during the heating seasons – An analytical study,Energy,KEEP – operational EE/control
10.1016/j.apenergy.2022.120500,2023,Multi-agent hierarchical reinforcement learning for energy management,Applied Energy,KEEP – operational EE/control
10.1016/j.jobe.2022.105240,2023,Study on the influencing factors on indoor PM<ce:inf loc=post>2.5</ce:inf> of office buildings in beijing based on statistical and machine learning methods,Journal of Building Engineering,Eliminated – unclear/other
10.1016/j.enbuild.2022.112652,2023,Digital twins for decoding human-building interaction in multi-domain test-rooms for environmental comfort and energy saving via graph representation,Energy and Buildings,Eliminated – unclear/other
10.1016/j.applthermaleng.2023.121309,2023,Hierarchical fault diagnosis and severity identification method of building air condition systems,Applied Thermal Engineering,Eliminated – unclear/other
10.1016/j.energy.2022.126399,2023,A day-ahead planning for multi-energy system in building community,Energy,Eliminated – Planning/Top-down
10.1016/j.apenergy.2022.120598,2023,Online transfer learning strategy for enhancing the scalability and deployment of deep reinforcement learning control in smart buildings,Applied Energy,KEEP – operational EE/control
10.1016/j.scs.2023.104726,2023,Towards the new generation of courtyard buildings as a healthy living concept for post-pandemic era,Sustainable Cities and Society,Eliminated – unclear/other
10.1016/j.jobe.2023.107021,2023,"Building digital twinning: Data, information, and models",Journal of Building Engineering,Eliminated – unclear/other
10.1016/j.measurement.2023.113140,2023,Digital twin-driven intelligent control of natural gas flowmeter calibration station,Measurement,KEEP – operational EE/control
10.1016/j.jobe.2023.105883,2023,A real-time fire evacuation system based on the integration of Building Information Modeling and Augmented Reality,Journal of Building Engineering,Eliminated – unclear/other
10.1016/j.enbuild.2023.112841,2023,New genetic algorithm-based workflow for multi-objective optimization of Net Zero Energy Buildings integrating robustness assessment,Energy and Buildings,Eliminated – unclear/other
10.1016/j.buildenv.2023.110371,2023,"Simulation-based assessment of ASHRAE Guideline 36, considering energy performance, indoor air quality, and control stability",Building and Environment,KEEP – operational EE/control
10.1016/j.jobe.2022.105559,2023,Improvement for energy efficiency and control characteristics in variable air volume system using in-situ sensor calibration method based on autoencoder,Journal of Building Engineering,KEEP – operational EE/control
10.1016/j.enbuild.2023.113608,2023,Developing energy flexibility in clusters of buildings: A critical analysis of barriers from planning to operation,Energy and Buildings,KEEP – operational EE/control
10.1016/j.jobe.2023.106960,2023,An algorithmic-based energy sharing model with peer-to-peer energy trading for clustered residential buildings,Journal of Building Engineering,Eliminated – unclear/other
10.1016/j.jobe.2023.105998,2023,Near-optimal adaptive predictive control model study for roller shades in office spaces,Journal of Building Engineering,KEEP – operational EE/control
10.1016/j.measurement.2023.112898,2023,On the metrological reliability of subsequent verification of thermal energy meters,Measurement,Eliminated – unclear/other
10.1016/j.enbuild.2022.112762,2023,Performance characterization of M-cycle indirect evaporative cooler and heat recovery ventilator for commercial buildings – Experiments and model,Energy and Buildings,Eliminated – unclear/other
10.1016/j.apenergy.2022.120621,2023,Quantum computing for future real-time building HVAC controls,Applied Energy,KEEP – operational EE/control
10.1016/j.scitotenv.2023.161919,2023,Parameter variability across different timescales in the energy balance-based model and its effect on evapotranspiration estimation,Science of The Total Environment,Eliminated – Monitoring/Forecasting only
10.1016/j.jobe.2023.106850,2023,Research on the indoor temperature regulation characteristics of a nearly zero energy building with the nonlinear heat capacity building components: A simple model,Journal of Building Engineering,Eliminated – unclear/other
10.1016/j.enbenv.2022.02.005,2023,Room temperature and humidity decoupling control of common variable air volume air-conditioning system based on bilinear characteristics,Energy and Built Environment,KEEP – operational EE/control
10.1016/j.jobe.2023.107520,2023,Improved building facade segmentation through digital twin-enabled RandLA-Net with empirical intensity correction model,Journal of Building Engineering,Eliminated – unclear/other
10.1016/j.enbuild.2023.113747,2023,Investigation of heating energy performance gap (EPG) in design and operation stages of residential buildings,Energy and Buildings,KEEP – operational EE/control
10.1016/j.buildenv.2023.110066,2023,Transmission mitigation of COVID-19: Exhaled contaminants removal and energy saving in densely occupied space by impinging jet ventilation,Building and Environment,KEEP – operational EE/control
10.1016/j.enbuild.2023.112790,2023,Dynamic analysis of the heat theft issue for residential buildings,Energy and Buildings,Eliminated – unclear/other
10.1016/j.apenergy.2023.120650,2023,A reinforcement learning-enabled iterative learning control strategy of air-conditioning systems for building energy saving by shortening the morning start period,Applied Energy,KEEP – operational EE/control
10.1016/j.apenergy.2023.121450,2023,An AI framework integrating physics-informed neural network with predictive control for energy-efficient food production in the built environment,Applied Energy,KEEP – operational EE/control
10.1016/j.enbuild.2022.112713,2023,In-situ comparison between the energy performance of an in-slab gas heating system and a split system air conditioning in classrooms,Energy and Buildings,Eliminated – unclear/other
10.1016/j.aei.2022.101868,2023,Towards emotionally intelligent buildings: A Convolutional neural network based approach to classify human emotional experience in virtual built environments,Advanced Engineering Informatics,Eliminated – unclear/other
10.1016/j.energy.2023.127075,2023,An energy demand-side management and net metering decision framework,Energy,KEEP – operational EE/control
10.1016/j.energy.2023.128084,2023,Domain adaptation deep learning and its T-S diagnosis networks for the cross-control and cross-condition scenarios in data center HVAC systems,Energy,KEEP – operational EE/control
10.1016/j.jobe.2023.106992,2023,Predictive control of power demand peak regulation based on deep reinforcement learning,Journal of Building Engineering,KEEP – operational EE/control
10.1016/j.autcon.2022.104662,2023,Low-cost mobile augmented reality service for building information modeling,Automation in Construction,Eliminated – unclear/other
10.1016/j.enbenv.2022.02.007,2023,Impact of occupant autonomy on satisfaction and building energy efficiency,Energy and Built Environment,KEEP – operational EE/control
10.1016/j.energy.2022.125494,2023,Model-based predictive control of multi-zone commercial building with a lumped building modelling approach,Energy,KEEP – operational EE/control
