DOI,Year,Title,Journal,Reason
10.1016/j.applthermaleng.2023.122158,2024,Mixed air temperature reset by data-driven model for optimal economizer control,Applied Thermal Engineering,KEEP – operational EE/control
10.1016/j.apenergy.2024.123969,2024,Economic model predictive control for building HVAC system: A comparative analysis of model-based and data-driven approaches using the BOPTEST Framework,Applied Energy,KEEP – operational EE/control
10.1016/j.jobe.2024.109887,2024,Real-time spatial-temporal mapping and visualization of thermal comfort and HVAC control by integrating immersive augmented reality technologies and IoT-enabled wireless sensor networks: Towards immersive human-building interactions,Journal of Building Engineering,KEEP – operational EE/control
10.1016/j.energy.2024.130507,2024,Effects of different zoning thermostat controls on thermal comfort and cooling energy consumption in reading rooms of a library,Energy,KEEP – operational EE/control
10.1016/j.enbuild.2024.113895,2024,Real-life data-driven model predictive control for building energy systems comparing different machine learning models,Energy and Buildings,KEEP – operational EE/control
10.1016/j.apenergy.2023.122258,2024,A data-driven DRL-based home energy management system optimization framework considering uncertain household parameters,Applied Energy,KEEP – operational EE/control
10.1016/j.enbuild.2024.114310,2024,Impact of practical challenges on the implementation of data-driven services for building operation: Insights from a real-life case study,Energy and Buildings,KEEP – operational EE/control
10.1016/j.enbuild.2024.114741,2024,Investigating the influence of uncertainty on office building energy simulation through occupant-centric control and thermal comfort integration,Energy and Buildings,KEEP – operational EE/control
10.1016/j.apenergy.2024.122627,2024,Optimization control strategy for mixed-mode buildings based on thermal comfort model: A case study of office buildings,Applied Energy,KEEP – operational EE/control
10.1016/j.enbuild.2024.114806,2024,Thermal comfort driven space heating control via hierarchical state machine strategy interacting with multiphysics simulation,Energy and Buildings,KEEP – operational EE/control
10.1016/j.apenergy.2023.122493,2024,Data-driven adaptive building thermal controller tuning with constraints: A primal–dual contextual Bayesian optimization approach,Applied Energy,KEEP – operational EE/control
10.1016/j.energy.2024.132440,2024,Energy efficiency and indoor thermal comfort of railway carriages: Development of an innovative passenger-centric-control framework for HVAC systems,Energy,KEEP – operational EE/control
10.1016/j.enbuild.2024.114497,2024,Investigating enhanced thermal comfort and energy efficiency through strategized airflow in Micro-Zonal Occupant-Centric Control (MZOCC),Energy and Buildings,KEEP – operational EE/control
10.1016/j.enbuild.2024.114803,2024,A novel model to detect abnormal thermal energy consumption in existing buildings with limited metering infrastructure,Energy and Buildings,Eliminated – unclear/other
10.1016/j.energy.2024.131396,2024,Energy-efficiency oriented occupancy space optimization in buildings: A data-driven approach based on multi-sensor fusion considering behavior-environment integration,Energy,KEEP – operational EE/control
10.1016/j.enbuild.2024.114898,2024,"Hybrid modeling based on integrating simulation and operational data to improve indoor air temperature predictions, a controlled variable in digital twin models",Energy and Buildings,KEEP – operational EE/control
10.1016/j.jobe.2024.109028,2024,AHU sensor fault diagnosis in various operating conditions based on a hybrid data-driven model combined energy consumption,Journal of Building Engineering,Eliminated – unclear/other
10.1016/j.enbuild.2024.114073,2024,"Cooling operation strategies in a typical neighborhood mosque: A Case study on electricity consumption, CO<ce:inf loc=post>2</ce:inf> emissions, and thermal comfort",Energy and Buildings,KEEP – operational EE/control
10.1016/j.aei.2024.102643,2024,Automated data-driven method for creating digital building models from dense point clouds and images through semantic segmentation and parametric model fitting,Advanced Engineering Informatics,Eliminated – unclear/other
10.1016/j.enbuild.2024.114709,2024,Data-driven analysis of heating and cooling base temperatures for buildings: Case studies in South Korea,Energy and Buildings,Eliminated – unclear/other
10.1016/j.jobe.2024.108917,2024,Modeling temporal dual variations for return air temperature prediction of mK-level temperature-controlled clean chamber,Journal of Building Engineering,KEEP – operational EE/control
10.1016/j.jobe.2024.110411,2024,Leveraging multi-zone building data with machine learning-based models and genetic algorithms to optimize air handling units,Journal of Building Engineering,Eliminated – unclear/other
10.1016/j.enbuild.2024.114317,2024,Energy savings of commercial kitchen ventilation and air conditioning systems based on cooking oil control and thermal comfort,Energy and Buildings,KEEP – operational EE/control
10.1016/j.apenergy.2024.123780,2024,Hierarchical MPC for building energy management: Incorporating data-driven error compensation and mitigating information asymmetry,Applied Energy,KEEP – operational EE/control
10.1016/j.apenergy.2024.123477,2024,Ventilation and temperature control for energy-efficient and healthy buildings: A differentiable PDE approach,Applied Energy,KEEP – operational EE/control
10.1016/j.jobe.2024.110877,2024,A robust data-driven model predictive thermal control for rack-based data center,Journal of Building Engineering,KEEP – operational EE/control
10.1016/j.apenergy.2023.122101,2024,Data-driven predictive control for demand side management: Theoretical and experimental results,Applied Energy,KEEP – operational EE/control
10.1016/j.jobe.2024.109497,2024,Reinforcement learning in building controls: A comparative study of algorithms considering model availability and policy representation,Journal of Building Engineering,KEEP – operational EE/control
10.1016/j.jobe.2024.111487,2024,Usage behavior and comfort effects of IoT-connected personalized environmental control systems,Journal of Building Engineering,KEEP – operational EE/control
10.1016/j.enbuild.2024.114774,2024,A data-driven standardised generalisable methodology to validate a large energy performance Certification dataset: A case of the application in Ireland,Energy and Buildings,Eliminated – unclear/other
10.1016/j.enbuild.2024.114071,2024,Opening the Black Box: Towards inherently interpretable energy data imputation models using building physics insight,Energy and Buildings,Eliminated – unclear/other
10.1016/j.apenergy.2023.122354,2024,Energy optimization for HVAC systems in multi-VAV open offices: A deep reinforcement learning approach,Applied Energy,KEEP – operational EE/control
10.1016/j.apenergy.2024.123581,2024,Demand response for residential buildings using hierarchical nonlinear model predictive control for plug-and-play,Applied Energy,KEEP – operational EE/control
10.1016/j.jobe.2024.110015,2024,Thermal and visual comforts of occupants for a naturally ventilated educational building in low-income economies: A machine learning approach,Journal of Building Engineering,KEEP – operational EE/control
10.1016/j.buildenv.2024.112093,2024,Humidity-aware model predictive control for residential air conditioning: A field study,Building and Environment,KEEP – operational EE/control
10.1016/j.apenergy.2024.123753,2024,Expert-guided imitation learning for energy management: Evaluating GAIL’s performance in building control applications,Applied Energy,KEEP – operational EE/control
10.1016/j.apenergy.2024.123414,2024,Scalable energy management approach of residential hybrid energy system using multi-agent deep reinforcement learning,Applied Energy,KEEP – operational EE/control
10.1016/j.enbuild.2024.114135,2024,Application of transfer learning to overcome data imbalance and extrapolation for model predictive control: A real-life case,Energy and Buildings,KEEP – operational EE/control
10.1016/j.enbuild.2024.114278,2024,Large language model-based interpretable machine learning control in building energy systems,Energy and Buildings,KEEP – operational EE/control
10.1016/j.buildenv.2024.111882,2024,Multi-objectives occupant-centric control of thermostats and natural ventilation systems in cold climate conditions using real-time occupant-related information,Building and Environment,KEEP – operational EE/control
10.1016/j.apenergy.2024.124003,2024,Controllable cross-building multi-objective optimisation for NZEBs: A framework Utilising parametric generation and intelligent algorithms,Applied Energy,KEEP – operational EE/control
10.1016/j.jobe.2024.109402,2024,A study on natural ventilation of dormitories for college students in northeast China during spring: A case of linear-shaped dormitory buildings,Journal of Building Engineering,Eliminated – Ventilation/IAQ only
10.1016/j.energy.2024.132636,2024,Recent advances in data mining and machine learning for enhanced building energy management,Energy,KEEP – operational EE/control
10.1016/j.enbuild.2024.114161,2024,Demand response for residential building heating: Effective Monte Carlo Tree Search control based on physics-informed neural networks,Energy and Buildings,KEEP – operational EE/control
10.1016/j.jobe.2024.110446,2024,Optimization of indoor temperature sensor deployment in large spaces for multiple building operation scenarios using the genetic algorithm,Journal of Building Engineering,KEEP – operational EE/control
10.1016/j.apenergy.2023.122413,2024,"A machine learning framework to estimate residential electricity demand based on smart meter electricity, climate, building characteristics, and socioeconomic datasets",Applied Energy,Eliminated – unclear/other
10.1016/j.enbuild.2024.114999,2024,"Building performance optimization through sensitivity Analysis, and economic insights using AI",Energy and Buildings,Eliminated – unclear/other
10.1016/j.enbuild.2024.114420,2024,Study on indoor temperature optimal control of air-conditioning based on Twin Delayed Deep Deterministic policy gradient algorithm,Energy and Buildings,KEEP – operational EE/control
10.1016/j.enbuild.2023.113752,2024,Quantification of HVAC energy savings through occupancy presence sensors in an apartment setting: Field testing and inverse modeling approach,Energy and Buildings,KEEP – operational EE/control
10.1016/j.enbuild.2024.114408,2024,A lifelong meta-learning approach for learning deep grey-box representative thermal dynamics models for residential buildings,Energy and Buildings,Eliminated – unclear/other
10.1016/j.buildenv.2024.111530,2024,Causal thinking: Uncovering hidden assumptions and interpretations of statistical analysis in building science,Building and Environment,Eliminated – unclear/other
10.1016/j.enbuild.2024.114595,2024,Exploring and field-demonstrating geofence-based occupancy-centric control in residential buildings,Energy and Buildings,KEEP – operational EE/control
10.1016/j.energy.2023.129797,2024,Optimal supply air temperature with respect to data center operational stability and energy efficiency in a row-based cooling system under fault conditions,Energy,KEEP – operational EE/control
10.1016/j.apenergy.2024.122820,2024,Field demonstration of predictive heating control for an all-electric house in a cold climate,Applied Energy,KEEP – operational EE/control
10.1016/j.applthermaleng.2024.122862,2024,Balancing ventilation performance and energy conservation: An integrated multi-objective optimization and preference-based decision-making model for optimizing impinging jet ventilation,Applied Thermal Engineering,Eliminated – Ventilation/IAQ only
10.1016/j.renene.2024.121449,2024,Enhanced temperature regulation in compound heating systems: Leveraging guided policy search and model predictive control,Renewable Energy,KEEP – operational EE/control
10.1016/j.apenergy.2024.123433,2024,Neural differential equations for temperature control in buildings under demand response programs,Applied Energy,KEEP – operational EE/control
10.1016/j.enbuild.2024.114954,2024,Automatic standard building category classification from smart meter data – A supervised learning approach,Energy and Buildings,Eliminated – Monitoring/Forecasting only
10.1016/j.enbuild.2023.113770,2024,Enhancing HVAC energy management through multi-zone occupant-centric approach: A multi-agent deep reinforcement learning solution,Energy and Buildings,KEEP – operational EE/control
10.1016/j.buildenv.2023.111069,2024,Development of an HVAC system control method using weather forecasting data with deep reinforcement learning algorithms,Building and Environment,KEEP – operational EE/control
10.1016/j.energy.2024.133704,2024,"Fault detection research on novel transfer learning-based method for cross-condition, cross-system and cross-operation in public building HVAC sensors",Energy,KEEP – operational EE/control
10.1016/j.enbuild.2023.113753,2024,Model predictive control of distributed energy resources in residential buildings considering forecast uncertainties,Energy and Buildings,KEEP – operational EE/control
10.1016/j.buildenv.2024.111631,2024,Effect of temperature step-changes and ramps on physiological and psychological responses of occupants in office buildings in summer,Building and Environment,KEEP – operational EE/control
10.1016/j.autcon.2024.105579,2024,Semantic model-based large-scale deployment of AI-driven building management applications,Automation in Construction,Eliminated – unclear/other
10.1016/j.enbuild.2023.113831,2024,Model Predictive Control in buildings with thermal and visual comfort constraints,Energy and Buildings,KEEP – operational EE/control
10.1016/j.enbuild.2024.114968,2024,Radiant heating systems control in buildings via Inverse Conformable Artificial Neural Networks and optimization techniques,Energy and Buildings,KEEP – operational EE/control
10.1016/j.energy.2024.131126,2024,Heuristic model predictive control implementation to activate energy flexibility in a fully electric school building,Energy,KEEP – operational EE/control
10.1016/j.enbuild.2024.114823,2024,Optimal control strategy for building HVAC systems: Satisfying flexible demand response with different value-based selection,Energy and Buildings,KEEP – operational EE/control
10.1016/j.scs.2024.105386,2024,Optimizing building spatial morphology to alleviate human thermal stress,Sustainable Cities and Society,Eliminated – unclear/other
10.1016/j.enbuild.2023.113884,2024,Model predictive control for demand flexibility of a residential building with multiple distributed energy resources,Energy and Buildings,KEEP – operational EE/control
10.1016/j.jobe.2024.110491,2024,"Reinforcement learning for occupant behavior modeling in public buildings: Why, what and how?",Journal of Building Engineering,KEEP – operational EE/control
10.1016/j.enbuild.2024.114346,2024,Towards feasible and credible building modelling reflecting the operational energy use and indoor environment – Nordic climate case study,Energy and Buildings,KEEP – operational EE/control
10.1016/j.buildenv.2023.111073,2024,Multi-objective optimization of building HVAC operation: Advanced strategy using Koopman predictive control and deep learning,Building and Environment,KEEP – operational EE/control
10.1016/j.apenergy.2023.122357,2024,Deep clustering of reinforcement learning based on the bang-bang principle to optimize the energy in multi-boiler for intelligent buildings,Applied Energy,KEEP – operational EE/control
10.1016/j.jobe.2024.108648,2024,A field study of investigation of indoor environmental quality status in Indian offices: Concerns and influencing building factors,Journal of Building Engineering,Eliminated – unclear/other
10.1016/j.energy.2024.132343,2024,A bi-level real-time optimal control strategy for thermal coupled multi-zone dedicated outside air system-assisted HVAC systems,Energy,KEEP – operational EE/control
10.1016/j.enbuild.2024.113964,2024,Multi-task deep learning for large-scale buildings energy management,Energy and Buildings,KEEP – operational EE/control
10.1016/j.energy.2024.130505,2024,Energy and comfort aware operation of multi-zone HVAC system through preference-inspired deep reinforcement learning,Energy,KEEP – operational EE/control
10.1016/j.buildenv.2024.111391,2024,Comparison of time-invariant and adaptive linear grey-box models for model predictive control of residential buildings,Building and Environment,KEEP – operational EE/control
10.1016/j.jobe.2024.110016,2024,Influence and optimal operating parameters of slit make-up air system on low-energy kitchen environment,Journal of Building Engineering,Eliminated – unclear/other
10.1016/j.applthermaleng.2023.122163,2024,"Exploring the natural ventilation potential for supertall buildings considering vertical meteorology: A case study in Harbin, China",Applied Thermal Engineering,Eliminated – Ventilation/IAQ only
10.1016/j.apenergy.2024.123707,2024,Overall and local environmental collaborative control based on personal comfort model and personal comfort system,Applied Energy,KEEP – operational EE/control
10.1016/j.jobe.2024.110729,2024,Estimating air conditioning energy consumption of residential buildings using hourly smart meter data,Journal of Building Engineering,Eliminated – unclear/other
10.1016/j.buildenv.2024.111688,2024,Influence of the natural makeup air system on the kitchen environment in low-energy buildings in severely cold regions,Building and Environment,Eliminated – unclear/other
10.1016/j.enbuild.2024.114142,2024,Experimental study on improvement of indoor thermal environment of buildings in high altitude areas at night in winter by different sheltering methods,Energy and Buildings,Eliminated – unclear/other
10.1016/j.apenergy.2024.123968,2024,Joint optimization for temperature and humidity independent control system based on multi-agent reinforcement learning with cooperative mechanisms,Applied Energy,KEEP – operational EE/control
10.1016/j.scs.2024.105787,2024,Thermal performance and energy efficacy of membrane-assisted radiant cooling outdoors,Sustainable Cities and Society,Eliminated – unclear/other
10.1016/j.enbuild.2024.114321,2024,Demonstrating the load-shifting potential of a schedule-based control in a real-life educational building,Energy and Buildings,KEEP – operational EE/control
10.1016/j.enbuild.2024.114065,2024,Modelling building HVAC control strategies using a deep reinforcement learning approach,Energy and Buildings,KEEP – operational EE/control
10.1016/j.enbuild.2024.113976,2024,Impact of thermal control by real-time PMV using estimated occupants personal factors of metabolic rate and clothing insulation,Energy and Buildings,KEEP – operational EE/control
10.1016/j.jobe.2024.111032,2024,Impact of space utilization and work time flexibility on energy performance of office buildings,Journal of Building Engineering,KEEP – operational EE/control
10.1016/j.enbuild.2024.114409,2024,An artificial intelligence framework for predicting operational energy consumption in office buildings,Energy and Buildings,KEEP – operational EE/control
10.1016/j.enbuild.2024.114580,2024,Physics-informed hybrid modeling methodology for building infiltration,Energy and Buildings,Eliminated – Ventilation/IAQ only
10.1016/j.enbuild.2024.114734,2024,Dynamic Cooling – A concept of time-sensitive thermal regulation to cut cooling energy demand in office buildings,Energy and Buildings,Eliminated – unclear/other
10.1016/j.enbuild.2024.114063,2024,"Hot, cold, or just right? An infrared biometric sensor to improve occupant comfort and reduce overcooling in buildings via closed-loop control",Energy and Buildings,KEEP – operational EE/control
10.1016/j.applthermaleng.2024.124336,2024,Energy consumption of a novel floor radiant cooling system in large space buildings,Applied Thermal Engineering,Eliminated – unclear/other
10.1016/j.buildenv.2024.111584,2024,Direct load control-based optimal scheduling strategy for demand response of air-conditioning systems in rural building complex,Building and Environment,KEEP – operational EE/control
10.1016/j.enbuild.2023.113771,2024,Enhancing energy efficiency and comfort with a multi-domain approach: Development of a novel human thermoregulatory model for occupant-centric control,Energy and Buildings,KEEP – operational EE/control
10.1016/j.buildenv.2024.111775,2024,Impact of dataset sampling period on building thermal models used for flexibility activation,Building and Environment,KEEP – operational EE/control
10.1016/j.buildenv.2024.111684,2024,A virtual sensing approach to enhancing personalized strategies for indoor environmental quality and residential energy management,Building and Environment,KEEP – operational EE/control
10.1016/j.apenergy.2023.122430,2024,Photovoltaic capacity dynamic tracking model predictive control strategy of air-conditioning systems with consideration of flexible loads,Applied Energy,KEEP – operational EE/control
10.1016/j.enbenv.2023.06.008,2024,Thermal energy performance of compressed earth building in two different cities in Moroccan semi-arid climate,Energy and Built Environment,KEEP – operational EE/control
10.1016/j.buildenv.2024.111501,2024,Occupancy sensor-enabled demand control ventilation using virtual outdoor air flow meters in air handling units without an outdoor air flow meter,Building and Environment,KEEP – operational EE/control
10.1016/j.enbuild.2023.113784,2024,Indoor environment quality effects on occupant satisfaction and energy consumption: Empirical evidence from subtropical offices,Energy and Buildings,KEEP – operational EE/control
10.1016/j.jobe.2024.109715,2024,Field demonstration of priority stack-based controls in an office building for demand response,Journal of Building Engineering,KEEP – operational EE/control
10.1016/j.enbuild.2024.114562,2024,Energy optimization algorithms for multi-residential buildings: A model predictive control application,Energy and Buildings,KEEP – operational EE/control
10.1016/j.enbuild.2023.113867,2024,A detailed occupant activity classification model in a residential environment using building monitoring data: Considering occupant characteristics,Energy and Buildings,KEEP – operational EE/control
10.1016/j.enbuild.2024.114879,2024,Dyna-PINN: Physics-informed deep dyna-q reinforcement learning for intelligent control of building heating system in low-diversity training data regimes,Energy and Buildings,KEEP – operational EE/control
10.1016/j.buildenv.2024.111464,2024,Model-based optimal control strategy for multizone VAV air-conditioning systems for neutralizing room pressure and minimizing fan energy consumption,Building and Environment,KEEP – operational EE/control
10.1016/j.apenergy.2023.121961,2024,"Assessing school ventilation strategies from the perspective of health, environment, and energy",Applied Energy,Eliminated – Ventilation/IAQ only
10.1016/j.enbuild.2024.114407,2024,"A/C usage intensity and adaptive comfort behaviour in residential buildings in South East Queensland, Australia",Energy and Buildings,Eliminated – unclear/other
10.1016/j.enbuild.2024.114830,2024,Effects of occupant thermostat preferences and override behavior on residential demand response in CityLearn,Energy and Buildings,KEEP – operational EE/control
10.1016/j.buildenv.2024.111856,2024,A practical real-time control strategy for high-performance building HVAC operation concerning potential pandemic outbreaks in post-pandemic era,Building and Environment,KEEP – operational EE/control
10.1016/j.jobe.2024.108950,2024,Approach of establishing a high-resolution shading occupant behavior model in the office building,Journal of Building Engineering,KEEP – operational EE/control
10.1016/j.jclepro.2023.140040,2024,A hybrid model of self-organizing map and deep learning with genetic algorithm for managing energy consumption in public buildings,Journal of Cleaner Production,Eliminated – unclear/other
10.1016/j.energy.2024.130344,2024,Successful application of predictive information in deep reinforcement learning control: A case study based on an office building HVAC system,Energy,KEEP – operational EE/control
10.1016/j.applthermaleng.2023.121545,2024,Filling time-series gaps using image techniques: Multidimensional context autoencoder approach for building energy data imputation,Applied Thermal Engineering,Eliminated – unclear/other
10.1016/j.enbuild.2024.114596,2024,Emulation and detection of physical faults and cyber-attacks on building energy systems through real-time hardware-in-the-loop experiments,Energy and Buildings,Eliminated – unclear/other
10.1016/j.enbuild.2024.114667,2024,Impact of refrigerant undercharge faults on building indoor conditions and HVAC system operation in residential Buildings: A simulation study,Energy and Buildings,KEEP – operational EE/control
10.1016/j.jobe.2024.111378,2024,Verification of the radiant time factor (RTF) and convective time factor (CTF) for radiant systems in the buildings,Journal of Building Engineering,Eliminated – unclear/other
10.1016/j.enbuild.2024.114696,2024,Multi-source transfer learning method for enhancing the deployment of deep reinforcement learning in multi-zone building HVAC control,Energy and Buildings,KEEP – operational EE/control
10.1016/j.applthermaleng.2024.123863,2024,Comparison of different control methods on the thermally activated building system (TABS) with large energy flexibility,Applied Thermal Engineering,KEEP – operational EE/control
