DOI,Year,Title,Journal,Reason
10.1016/j.jobe.2023.106991,2023,"An integrated pipeline for building performance analysis: Daylighting, energy, natural ventilation, and airborne contaminant dispersion",Journal of Building Engineering,Eliminated – Ventilation/IAQ only
10.1016/j.jobe.2023.107463,2023,Multi-agent based distributed cooperative control of air-conditioning systems for building fast demand response,Journal of Building Engineering,KEEP – operational EE/control
10.1016/j.enbenv.2022.02.011,2023,Generating hourly electricity demand data for large-scale single-family buildings by a decomposition-recombination method,Energy and Built Environment,Eliminated – unclear/other
10.1016/j.enbuild.2022.112717,2023,Net-positive office commissioning and performance gap assessment: Empirical insights,Energy and Buildings,Eliminated – unclear/other
10.1016/j.apenergy.2023.120862,2023,An enhanced principal component analysis method with Savitzky–Golay filter and clustering algorithm for sensor fault detection and diagnosis,Applied Energy,KEEP – operational EE/control
10.1016/j.jobe.2023.107068,2023,Parametric building information modelling and optimality criteria methods for automated multi-objective optimisation of structural and energy efficiency,Journal of Building Engineering,Eliminated – unclear/other
10.1016/j.buildenv.2023.110099,2023,A CFD-based framework to assess airborne infection risk in buildings,Building and Environment,Eliminated – unclear/other
10.1016/j.buildenv.2023.110467,2023,Research on optimal control of HVAC system using swarm intelligence algorithms,Building and Environment,KEEP – operational EE/control
10.1016/j.scs.2023.104850,2023,MEMS: An automated multi-energy management system for smart residences using the DD-LSTM approach,Sustainable Cities and Society,KEEP – operational EE/control
10.1016/j.enbuild.2023.113576,2023,Enhancing self-consumption for decarbonization: An optimization strategy based on a calibrated building energy model,Energy and Buildings,Eliminated – unclear/other
10.1016/j.enbuild.2023.113200,2023,Approach in development and implementation of automatic control system in a smart building,Energy and Buildings,KEEP – operational EE/control
10.1016/j.energy.2023.127331,2023,An infiltration load calculation model of large-space buildings based on the grand canonical ensemble theory,Energy,Eliminated – Ventilation/IAQ only
10.1016/j.energy.2022.125944,2023,How combination of control methods and renewable energies leads a large commercial building to a zero-emission zone – A case study in U.S.,Energy,KEEP – operational EE/control
10.1016/j.buildenv.2023.110806,2023,Ten questions concerning thermal resilience of buildings and occupants for climate adaptation,Building and Environment,KEEP – operational EE/control
10.1016/j.buildenv.2023.110584,2023,Surrogate-assisted high-accuracy observation modeling in building digital twins: In situ nonintrusive modeling without sensor observation (<ce:italic>Y</ce:italic>),Building and Environment,Eliminated – unclear/other
10.1016/j.enbuild.2023.113267,2023,An ontology-based framework for automatic building energy modeling with thermal zoning,Energy and Buildings,Eliminated – Planning/Top-down
10.1016/j.aei.2023.101895,2023,An intelligent HVAC control strategy for supplying comfortable and energy-efficient school environment,Advanced Engineering Informatics,KEEP – operational EE/control
10.1016/j.jobe.2023.106536,2023,"A new framework integrating reinforcement learning, a rule-based expert system, and decision tree analysis to improve building energy flexibility",Journal of Building Engineering,KEEP – operational EE/control
10.1016/j.jobe.2023.106204,2023,Hierarchical multi-agent control framework for energy efficiency and carbon emission reduction in multi-zone buildings,Journal of Building Engineering,KEEP – operational EE/control
10.1016/j.energy.2023.127540,2023,A comparison of approaches with different constraint handling techniques for energy-efficient building form optimization,Energy,Eliminated – unclear/other
10.1016/j.jobe.2023.106225,2023,In situ virtual sensing for dwelling infiltration rates in multi-unit residential buildings,Journal of Building Engineering,Eliminated – Ventilation/IAQ only
10.1016/j.jobe.2023.106063,2023,"Potential impact of work from home jobs on residential energy bills: A case study in phoenix, AZ, USA",Journal of Building Engineering,Eliminated – unclear/other
10.1016/j.enbuild.2022.112627,2023,Human decision making during eco-feedback intervention in smart and connected energy-aware communities,Energy and Buildings,Eliminated – unclear/other
10.1016/j.jobe.2023.106810,2023,Thermal performance and energy efficiency of the composite clay and hemp fibers,Journal of Building Engineering,Eliminated – unclear/other
10.1016/j.renene.2023.119002,2023,A hybrid approach based energy management for building resilience against power outage by shared parking station for EVs,Renewable Energy,KEEP – operational EE/control
10.1016/j.energy.2023.128894,2023,Investigation of energy recovery performance and frost risk of membrane enthalpy exchanger applied in cold climates,Energy,Eliminated – unclear/other
10.1016/j.enbuild.2023.113260,2023,Quantifying the financial value of building decarbonization technology under uncertainty: Integrating energy modeling and investment analysis,Energy and Buildings,Eliminated – unclear/other
10.1016/j.enbuild.2023.112776,2023,Smarter building start – A distributed solution,Energy and Buildings,Eliminated – unclear/other
10.1016/j.apenergy.2023.121106,2023,Energy saving and indoor temperature control for an office building using tube-based robust model predictive control,Applied Energy,KEEP – operational EE/control
10.1016/j.enbuild.2023.113153,2023,Estimation of heating system energy modeling profiles based on environmental monitoring records in Central-Southern Chile,Energy and Buildings,Eliminated – Monitoring/Forecasting only
10.1016/j.autcon.2023.105122,2023,Visual Brick model authoring tool for building metadata standardization,Automation in Construction,Eliminated – unclear/other
10.1016/j.enbuild.2023.113106,2023,Classifying the operational energy performance of buildings with the use of digital twins,Energy and Buildings,KEEP – operational EE/control
10.1016/j.autcon.2022.104642,2023,Automated extraction of geometric primitives with solid lines from unstructured point clouds for creating digital buildings models,Automation in Construction,Eliminated – unclear/other
10.1016/j.energy.2022.125680,2023,Development of a probabilistic behavioural model creating diverse A/C operation patterns of households,Energy,KEEP – operational EE/control
10.1016/j.jobe.2023.106114,2023,Flexibility quantification and enhancement of flexible electric energy systems in buildings,Journal of Building Engineering,KEEP – operational EE/control
10.1016/j.buildenv.2023.110556,2023,Developing smart air purifier control strategies for better IAQ and energy efficiency using reinforcement learning,Building and Environment,KEEP – operational EE/control
10.1016/j.enbuild.2022.112735,2023,An optimal operational scheduling model for energy-efficient building with dynamic heat loss prediction,Energy and Buildings,KEEP – operational EE/control
10.1016/j.apenergy.2023.121454,2023,Occupant-oriented demand response with multi-zone thermal building control,Applied Energy,KEEP – operational EE/control
10.1016/j.enbuild.2023.113367,2023,An efficient sensor and thermal coupling fault diagnosis methodology for building energy systems,Energy and Buildings,Eliminated – unclear/other
10.1016/j.enbuild.2023.113549,2023,Assessment of climate classification methodologies used in building energy efficiency sector,Energy and Buildings,Eliminated – Monitoring/Forecasting only
10.1016/j.enbuild.2023.112949,2023,Interpretation of convolutional neural network-based building HVAC fault diagnosis model using improved layer-wise relevance propagation,Energy and Buildings,Eliminated – unclear/other
10.1016/j.energy.2023.128447,2023,Impact of outdoor humidity conditions on building energy performance and environmental footprint in the degree days-based climate classification,Energy,Eliminated – Monitoring/Forecasting only
10.1016/j.jobe.2023.106233,2023,Appropriate level of development of in-situ building information modeling for existing building energy modeling implementation,Journal of Building Engineering,Eliminated – unclear/other
10.1016/j.enbuild.2023.112774,2023,"MILP-based model predictive control for home energy management systems: A real case study in Algarve, Portugal",Energy and Buildings,KEEP – operational EE/control
10.1016/j.enbuild.2023.113590,2023,Behavioral energy efficiency with environment sensors: A case in Hong Kong,Energy and Buildings,Eliminated – unclear/other
10.1016/j.enbuild.2023.113332,2023,Cost-optimal analysis of energy efficient hvac solution-sets for low-energy apartment buildings,Energy and Buildings,Eliminated – unclear/other
10.1016/j.apenergy.2023.120701,2023,Augmenting energy time-series for data-efficient imputation of missing values,Applied Energy,Eliminated – unclear/other
10.1016/j.enbuild.2022.112728,2023,Evaluating optimal control of active insulation and HVAC systems in residential buildings,Energy and Buildings,KEEP – operational EE/control
10.1016/j.autcon.2023.105096,2023,Enabling technologies for remote and virtual inspection of building work,Automation in Construction,Eliminated – unclear/other
10.1016/j.jobe.2023.107657,2023,Potential quantification and impact factors analysis of energy flexibility in residential buildings with preheating control strategies,Journal of Building Engineering,KEEP – operational EE/control
10.1016/j.scs.2023.104994,2023,Analyzing the impact of various factors on leaf surface temperature based on a new tree-scale canopy energy balance model,Sustainable Cities and Society,Eliminated – unclear/other
10.1016/j.buildenv.2022.109871,2023,The impact of thermal environment of transition spaces in elderly-care buildings on thermal adaptation and thermal behavior of the elderly,Building and Environment,Eliminated – unclear/other
10.1016/j.enbuild.2023.113658,2023,Neural-assisted HVACs optimal scheduling for renewable energy communities,Energy and Buildings,KEEP – operational EE/control
10.1016/j.enbuild.2023.113698,2023,Energy flexibility using the thermal mass of residential buildings,Energy and Buildings,KEEP – operational EE/control
10.1016/j.jobe.2023.106598,2023,Optimization of visual comfort: Building openings,Journal of Building Engineering,Eliminated – unclear/other
10.1016/j.applthermaleng.2023.120024,2023,Coordinated optimization of robustness and flexibility of building heating systems for demand response control considering prediction uncertainty,Applied Thermal Engineering,KEEP – operational EE/control
10.1016/j.jobe.2023.106702,2023,Research on a surrogate model updating-based efficient multi-objective optimization framework for supertall buildings,Journal of Building Engineering,Eliminated – unclear/other
10.1016/j.energy.2023.128393,2023,Comparison of calculation and consumption methods for determining Energy Performance Certificates (EPC) in the case of multi-family residential buildings in Poland (Central-Eastern Europe),Energy,Eliminated – unclear/other
10.1016/j.apenergy.2023.120676,2023,PANDEMIC: Occupancy driven predictive ventilation control to minimize energy consumption and infection risk,Applied Energy,KEEP – operational EE/control
10.1016/j.enbuild.2023.113419,2023,Abnormal energy consumption detection using ensemble model for water chilling unit on HVAC system,Energy and Buildings,Eliminated – unclear/other
10.1016/j.enbuild.2022.112594,2023,Model-free dynamic management strategy for low-carbon home energy based on deep reinforcement learning accommodating stochastic environments,Energy and Buildings,KEEP – operational EE/control
10.1016/j.ijepes.2022.108588,2023,Thermo-Electrical state and demand response potential estimation for power systems with building thermostats,International Journal of Electrical Power & Energy Systems,KEEP – operational EE/control
10.1016/j.buildenv.2023.110593,2023,Dynamic thermal demand analysis of residential buildings based on IoT air conditioner,Building and Environment,Eliminated – unclear/other
10.1016/j.rser.2023.113370,2023,Building integrated photovoltaic/thermal technologies in Middle Eastern and North African countries: Current trends and future perspectives,Renewable and Sustainable Energy Reviews,Eliminated – Renewable-only
10.1016/j.enbuild.2022.112766,2023,In-situ observation virtual sensor in building systems toward virtual sensing-enabled digital twins,Energy and Buildings,Eliminated – unclear/other
10.1016/j.enbuild.2023.113223,2023,Smart home energy management with mitigation of power profile uncertainties and model errors,Energy and Buildings,KEEP – operational EE/control
10.1016/j.energy.2023.126650,2023,Multi-objective problem of optimizing heat transfer and energy production in algal bioreactive façades,Energy,Eliminated – unclear/other
10.1016/j.enbuild.2023.113392,2023,Study on key factors affecting the high-order building model order reduction for model predictive control application,Energy and Buildings,KEEP – operational EE/control
10.1016/j.buildenv.2023.110604,2023,A structural equation modelling paradigm for eco-rehabilitation and adaptive reuse of cultural heritage buildings,Building and Environment,Eliminated – unclear/other
10.1016/j.jobe.2023.107846,2023,An analytical model of stack ventilation in a shaft with controllable air volume,Journal of Building Engineering,KEEP – operational EE/control
10.1016/j.autcon.2022.104695,2023,Digital twin enabled fault detection and diagnosis process for building HVAC systems,Automation in Construction,KEEP – operational EE/control
10.1016/j.buildenv.2023.110030,2023,A two-phase online air balancing method for multi-zone ventilation systems based on distributed finite-time control,Building and Environment,KEEP – operational EE/control
10.1016/j.ijrefrig.2023.07.010,2023,Energy and exergy analysis of a subfreezing evaporator environment ammonia-water absorption refrigeration cycle: Machine learning and parametric optimization,International Journal of Refrigeration,Eliminated – Other/Industry
10.1016/j.enbuild.2023.112799,2023,Energy-saving potential in Indian open-plan offices using Micro-Zonal Occupant Centric Control (MZOCC),Energy and Buildings,KEEP – operational EE/control
10.1016/j.enbuild.2023.113032,2023,Research and application of park multi-source synergistic and complementary heating system and its coordinated control method,Energy and Buildings,KEEP – operational EE/control
10.1016/j.jobe.2023.106653,2023,Gaussian Mixture Model based pattern recognition for understanding the long-term impact of COVID-19 on energy consumption of public buildings,Journal of Building Engineering,Eliminated – unclear/other
10.1016/j.jobe.2023.106038,2023,Development of a white-box dynamic building thermal model integrated with a heating system,Journal of Building Engineering,Eliminated – unclear/other
10.1016/j.aei.2023.102097,2023,Fire propagation-driven dynamic intelligent evacuation model in multifloor hybrid buildings,Advanced Engineering Informatics,Eliminated – unclear/other
10.1016/j.enbuild.2023.113369,2023,Aggregation ready flexibility management methods for mechanical ventilation systems in buildings,Energy and Buildings,KEEP – operational EE/control
10.1016/j.enbuild.2023.113226,2023,DeepEdge-NILM: A case study of non-intrusive load monitoring edge device in commercial building,Energy and Buildings,Eliminated – Monitoring/Forecasting only
10.1016/j.jobe.2023.106775,2023,Typical daily occupancy profiles of express hotels and its stochasticity effect on building heating and cooling loads,Journal of Building Engineering,KEEP – operational EE/control
10.1016/j.energy.2023.128020,2023,A new method of generating extreme building energy year and its application,Energy,Eliminated – unclear/other
10.1016/j.jobe.2023.107509,2023,A novel oxygen-enriched method for sentry buildings on plateaus based on an attached jet,Journal of Building Engineering,Eliminated – unclear/other
10.1016/j.enbuild.2022.112616,2023,Optimal components capacity based multi-objective optimization and optimal scheduling based MPC-optimization algorithm in smart apartment buildings,Energy and Buildings,KEEP – operational EE/control
10.1016/j.apenergy.2023.121128,2023,Digital twin based reinforcement learning for extracting network structures and load patterns in planning and operation of distribution systems,Applied Energy,KEEP – operational EE/control
10.1016/j.enbuild.2023.113428,2023,The impact of COVID-19 on household energy consumption in England and Wales from April 2020 to March 2022,Energy and Buildings,Eliminated – unclear/other
10.1016/j.scitotenv.2023.161977,2023,Relative uncertainty-based Bayesian interlaboratory consensus building,Science of The Total Environment,Eliminated – unclear/other
10.1016/j.apenergy.2023.122003,2023,Towards COP27: Decarbonization patterns of residential building in China and India,Applied Energy,Eliminated – unclear/other
10.1016/j.energy.2023.127697,2023,"Key technologies and developments of multi-energy system: Three-layer framework, modelling and optimisation",Energy,Eliminated – unclear/other
10.1016/j.scs.2023.104942,2023,Dehumidification load ratio: influence mechanism on air conditioning and energy saving potential analysis for building cooling,Sustainable Cities and Society,Eliminated – unclear/other
10.1016/j.enbuild.2023.112779,2023,Advanced control framework of regenerative electric heating with renewable energy based on multi-agent cooperation,Energy and Buildings,KEEP – operational EE/control
10.1016/j.jobe.2022.105489,2023,Occupant preferences on the interaction with human-centered control systems in school buildings,Journal of Building Engineering,KEEP – operational EE/control
10.1016/j.jobe.2023.106650,2023,Building fire alarm model based on fire source inversion according to smoke arrival time intervals,Journal of Building Engineering,Eliminated – unclear/other
10.1016/j.jobe.2023.106532,2023,Determining an optimal sensor system for smart buildings with uncertain energy supply and demand,Journal of Building Engineering,Eliminated – unclear/other
10.1016/j.jobe.2023.105899,2023,Large-scale fire spread model for traditional Chinese building communities,Journal of Building Engineering,Eliminated – unclear/other
10.1016/j.aei.2022.101847,2023,Optimization of an office building form using a lattice incubate boxes method,Advanced Engineering Informatics,Eliminated – unclear/other
10.1016/j.enbuild.2022.112770,2023,A thermal performance standard for residential buildings in warm climates: Lessons learned in Brazil,Energy and Buildings,Eliminated – unclear/other
10.1016/j.energy.2022.125939,2023,Understanding multi-scale spatiotemporal energy consumption data: A visual analysis approach,Energy,Eliminated – unclear/other
10.1016/j.apenergy.2022.120542,2023,"Estimating building energy efficiency from street view imagery, aerial imagery, and land surface temperature data",Applied Energy,Eliminated – unclear/other
10.1016/j.jobe.2023.107427,2023,Experimental verification of artificial neural network scalability for performance monitoring of multi-split type air conditioners,Journal of Building Engineering,Eliminated – Monitoring/Forecasting only
10.1016/j.jobe.2023.106101,2023,Optimal design method for photovoltaic shading devices (PVSDs) by combining geometric optimization and adaptive control model,Journal of Building Engineering,KEEP – operational EE/control
10.1016/j.buildenv.2022.109899,2023,Building parameters that influence overheating of apartment buildings in a temperate climate in Southern Europe,Building and Environment,Eliminated – unclear/other
10.1016/j.enbuild.2023.113344,2023,Thermal performance of highly glazed office buildings in the tropics: Contradicting architectś expectations,Energy and Buildings,Eliminated – unclear/other
10.1016/j.buildenv.2023.110815,2023,Outdoor thermal condition based-segmented intermittent demand-controlled ventilation for constant-air-volume system,Building and Environment,KEEP – operational EE/control
10.1016/j.buildenv.2023.110152,2023,Impact of heatwaves and system shocks on a nearly zero energy educational building: Is it resilient to overheating?,Building and Environment,Eliminated – unclear/other
10.1016/j.enbuild.2023.113136,2023,An optimal control strategy for ASHP units with a novel dual-fan outdoor coil for evener frosting along airflow direction based on GRNN modelling,Energy and Buildings,KEEP – operational EE/control
10.1016/j.jobe.2022.105717,2023,Identifying the influence of user behaviour on building energy consumption based on model-based analysis of in-situ monitoring data,Journal of Building Engineering,Eliminated – Monitoring/Forecasting only
10.1016/j.renene.2023.119193,2023,Cooling performance of all-orientated building facades integrated with photovoltaic-sky radiative cooling system in summer,Renewable Energy,Eliminated – Renewable-only
10.1016/j.energy.2023.129039,2023,Optimization model for home energy management system of rural dwellings,Energy,KEEP – operational EE/control
10.1016/j.energy.2022.125942,2023,The thermal performance and applicability analysis of the composite ventilation system with heat recovery in ultra-low energy buildings,Energy,Eliminated – Ventilation/IAQ only
10.1016/j.enbuild.2023.113273,2023,"Substitution of heating systems in the Italian buildings panorama and potential for energy, environmental and economic efficiency improvement",Energy and Buildings,Eliminated – unclear/other
10.1016/j.jobe.2022.105647,2023,Development of early fire detection model for buildings using computer vision-based CCTV,Journal of Building Engineering,Eliminated – unclear/other
10.1016/j.jobe.2023.106025,2023,Function matters: Development of a value engineering building–function–assessment framework from stakeholders’ perspectives using hybrid analytical methods,Journal of Building Engineering,Eliminated – unclear/other
10.1016/j.applthermaleng.2023.120721,2023,Global sensitivity analysis of fan coil air conditioning demand response—A case study of medium-sized office buildings,Applied Thermal Engineering,KEEP – operational EE/control
10.1016/j.jobe.2023.107655,2023,Fire scenario-based damage assessment of ductile reinforced concrete buildings using computational fluid dynamics models,Journal of Building Engineering,Eliminated – Planning/Top-down
10.1016/j.enbuild.2022.112738,2023,A compensation model for an NDIR-based CO<ce:inf loc=post>2</ce:inf> sensor and its energy implication on demand control ventilation in a hot and humid climate,Energy and Buildings,KEEP – operational EE/control
10.1016/j.enbuild.2023.113630,2023,Multi-parametric optimization volumetric porosity to minimize energy consumption in high-rise residential complexes,Energy and Buildings,Eliminated – unclear/other
10.1016/j.jclepro.2023.136625,2023,Life cycle assessment of stone buildings in the Taihang mountains of Hebei province: Evolution towards cleaner production and operation,Journal of Cleaner Production,KEEP – operational EE/control
10.1016/j.enbuild.2022.112748,2023,Technical and economic feasibility study for a university zero energy building in Southern Brazil,Energy and Buildings,Eliminated – unclear/other
10.1016/j.enbuild.2023.113112,2023,Climate-change related evolution of future building cooling energy demand in a Mediterranean Country,Energy and Buildings,Eliminated – unclear/other
10.1016/j.enbuild.2023.113056,2023,Energy flexibility of building systems in future scenarios: optimization of the control strategy of a dynamic shading system and definition of a new energy flexibility metric,Energy and Buildings,KEEP – operational EE/control
10.1016/j.scitotenv.2023.164088,2023,Carbon and water footprint analysis of pig farm buildings in Northeast China using building-information-modeling enabled assessment,Science of The Total Environment,Eliminated – unclear/other
10.1016/j.buildenv.2023.110170,2023,Recognition of typical environmental control behavior patterns of indoor occupants based on temporal series association analysis,Building and Environment,KEEP – operational EE/control
10.1016/j.buildenv.2022.109909,2023,"A 2E, energy and environment performance of an optimized vernacular house for passive cooling - Case of North-East India",Building and Environment,Eliminated – unclear/other
10.1016/j.buildenv.2023.109990,2023,New metrics for thermal resilience of passive buildings during heat events,Building and Environment,Eliminated – unclear/other
10.1016/j.ijepes.2023.109442,2023,Integrating non-intrusive load monitoring based on graph-to-point learning into a self-adaptive home energy management system,International Journal of Electrical Power & Energy Systems,KEEP – operational EE/control
10.1016/j.enbuild.2023.112884,2023,Conducting smart energy audits of buildings with the use of building information modelling,Energy and Buildings,Eliminated – unclear/other
10.1016/j.buildenv.2023.110096,2023,Exploring the effect of longwave radiation exchange on the energy balance of building façades in subtropical regions,Building and Environment,Eliminated – unclear/other
10.1016/j.apenergy.2023.121508,2023,Representing decentralized generation and local energy use flexibility in an energy system optimization model,Applied Energy,KEEP – operational EE/control
